שם מלא,שם סיפור,הסיפור,תקופה,שנה
גרשום שופמן ,בין לילה ויום,"מדרכת האַספלט האפורה קיבלה גון של שיש טהור לרוח־הערב, שעה שאפשר היה לפגוש שם את סוֹטרה בת השש־עשרה, בלכתה אל הספריה להחליף את ספרה. את הספר נושאת היתה, כדרכה, דרך זלזול – ידעה, ידעה הקטנה, שהגיבּוֹרה שבו, עם כל הרעש העוטר אותה שם, אינה מגיעה לקרסוליה. – למה את אצה כל כך? – אין לי פנאי. אם אני באה הביתה שלא בשעה הקבועה, אמא תיכף: “היכן היית?!”

והיא מתחילה נוהמת דרך הילוכה־ריצתה את קטעי הנעימות המתוקות, שזה אך תמול שלשום הובאו הלום ממרחקים על ידי בנות־הוַריֶטֶה החדשות. כיצד הספיקו ניגונים אלה להגיע בינתים אליה, שמעודה לא ראתה את הלילה בחוץ אחר נעילת השער?! מעין טלגרף בלי־חוטים בינה ובין אותו העולם.

הרחובות הידועים נעשים זרים לפתע וטעוני־תעיה. רחוקים ופגומי־דמות מרפרפים המַכּרים והידידים, שמזדמנים בדרך, כי זו היתה הנערה־האושר, נשמת־העיר, ששמה רעד בצלילי־הכנסיות ובבבוּאת־השקיעה שבחלונות העליונים. ופעם אחת הירהר: היום אני מוכרח לנשקה, ויהי מה! בחזרה אלַונה עד ביתה, ושם בפרוזדור, ליד המדרגות…

אך בקרבם אל הסמטה שלה, הושיטה לו את ידה:

– להתראות! מכאן ואילך אני הולכת לבדי. אמא משקפת בעד החלון.

הביט אחריה עד שהפליגה בעלטת הערב. אותה שעה הודלקו הפנסים ברחוב ואור נפל עליה בטרם נעלמה מעיניו.

עייף, באחרית הימים, פגש אותה בליל־קיץ חם בטיילת הראשית שבכרך־הבירה. לא נזדעזע. כהרף־עין תפס את כל הגלגולים מראש ועד סוף. הוא הלא צפה את הדבר עוד אז.

כתולעת־יוחנא זו שנתפסה בכף… מדרכת האַספלט היתה כאן מלאה אשפה וניירות־פרסומת ואת קטעי הנעימות המתוקות והשגורות ניגנו עכשיו מאליהם בתוך ה“אַבטומַטים” הכינורות ההפוכים.

–… למה את אצה כל כך?

– אין לי פנאי. מחכים לי…

יוהרה עליונה הוטלה בעיניה, והן כבר לא ראו את האחד, אלא שוטטו פזורות בהמונים, בהמונים – ושוב רחוקה ובלתי־מושגת, כמו תחת כנף־אמה לפנים.

– להתראות! – הושיטה לו את ידה האורירית – מכאן ואילך אני הולכת לבדי…

הביט אחריה עד שהפליגה בינות לאוּרי הלילה. אותה שעה כוּבוּ הפנסים ברחוב – והיא הבהיקה לבנת־שמלה מתוך עלטת־השחר.
",התחיה,1930
גרשום שופמן ,בינינו לבין עצמינו ,"אין שוער, סטרוּז' בלעז, ואין שוערת, זו האשה העבה, הכרסתנית, עזת־הפנים, עם צרור־המפתחות הכבד בחגורתה. הבתים פתוחים כל הלילה, ואין “פרץ” ושאר מעשי ליסטים. אין נעילת שער וכל הכרוך בה, ובלב קל הנך שב הביתה גם אחרי חצות, לא כמו באירופה בשעתה.

ובחוץ אין אתה נתקל בשוטר עם כל פסיעה. אותו, את השוטר, אם צורך בו, אתה מוכרח לחפש.

ואפילו התנועה ברחובות מתכוונת מאליה כמעט, ללא הוראות הידים בכסיות הלבנות. כלי־הרכב, אמנם, נוגעים זה בזה לפעמים, אבל לידי התנגשות רצינית, למרות האור המסנוור, אין הדבר מגיע אלא לעתים רחוקות.

שם, בכרכי חוץ־לארץ, אך נתעכבו על המדרכה שנים שלושה אנשים במקום אחד, מיד גערת השוטר: “אַל התקהל!”, ואילו כאן מתלכדים האנשים ברחובות וב“שדרות”, גושים גושים, ועוסקים ב“פוליטיקה” – ואין מוחה בידם. מאחורי אחד הגושים הללו עומד לו יהודי בצידוד ראש ומטה אוזן בדחילו, באמונה (ממש כמו אלתר המלמד בשעתו, לפני ארבעים שנה, בבית המדרש, בין מנחה למעריב – אל ה“פוליטיקה” של הימים ההם; זו הטיית־האוזן הנצחית…). ידונו, יתווכחו ויתפלספו להם כלבבם – בראש־חוצות!

הנה פרצה קטטה בין מצחצחי־נעלים, והחזק הרים יד על החלש ממנו. עוברים ושבים מפרידים כרגע בין הנצים, דוחקים את זה לכאן ואת זה לכאן – וחסל.

הכל, איפוא, מתישב מאליו, בינינו לבין עצמנו, ללא התערבות של שוטרים ומגלביהם, ללא דין ודיין!

מהומה קמה פתאום מסביב לעגלת קלחי־תירס שלוּקים על הטיילת שליד הים. מה אירע כאן? בעל התירס, תוך כדי טיפולו בלקוחותיו ובדוד הרותחין שלו, הרגיש בבחור אחד, ששלח יד בחשאי בכסף הפדיון שבקערה, תפסו בעצם גניבתו והתנפל עליו באגרופיו.

– אַל הכות! – נזדעזעו ההמונים מסביב – אַל תעשה דין לעצמך! להכות אסור!!

והם הגנו על העלם המוכה, חילצוהו ושלחוהו לנפשו.

שם, באירופה, היה מופיע תיכף השוטר־הענק, מוציא בנחת את פנקסו ורושם לו את שם האיש וכתבתו וכו', ואחר כך היה מוליך את קרבנו אל ה“קומיסריאט” (המשטרה) ומשם אל בית־הכלא – ואחריתו (של “הגנב”) עדי אובד! ואילו אצלנו –

– אַל הכות! להכות אסור!!

– הא כיצד?! – נשתלהב וצוח מוכר ה“קוקורוזות” – הנה זה בא ולוקח את כספי לעיני ואני אחריש?!!

– ואם לקח, אז מה? – נשתלהבה לעומתו אשה צעירה מתוך הקהל אף היא – ואם לקח, אז מה?! ובכן, לקח!!
",התחיה,1930
גרשום שופמן ,בשער הטמפל,"עיר ואם בגרמניה.

הבנין מזדקר באדמומיתו (מערומי לבנים, ללא טיח־סיד) וב“מגן דוד” שבראשו. על הקיר מבחוץ תלויה טבלה שחורה גדולה עם רשימת צעירי היהודים (באותיות זהב), בני עיר זו, שנפלו חללים במלחמת־העולם “בעד המולדת”. אדוני הארץ, הביטו וראו!..

בחצר, בכפיפה אחת עם בית־האלוהים, נמצא גם בית־ספר יהודי לתינוקות, בו מלמדים בצד הלימודים הכלליים גם קצת עברית בהברה ה“טמפּלית”. המורים אינם מומחים גדולים במקצוע זה, והרי הם כפופים לרב העדה, הרב מטעם, שהוא גם פרופיסור לשפות השמיות באוניברסיטה המקומית. (בדפוק איש על דלת מעונו ושואל:

האדון הרבינר בביתו?
מתקנים לו שם תיכף:

– האדון הפּרופיסור?..).

בצהרים, לעת צאת התלמידים והתלמידות הקטנים מבית־ספרם, צובאות ומחכות להם כאן אמותיהם ואומנותיהם. האחרונות נוצריות הן ברובן, והרי הן שולחות בתוך כך מבט נוהה אל הילדים הנוצרים, תלמידי בית־הספר הכללי, הנמצא בסמוך אף הוא. הנה הציפו הללו את הרחוב ברעש כדול, חולפים בהמוניהם על שער הטמפּל ומציצים פנימה בלעג. מהם גם מתוים בחטיפה על הגדר את צלב־הקרס.

ברגע זה יוצאים בלוית מוריהם גם הנערים היהודים מבית־ספרם הם – והמלחמה ברחוב, בין שני המחנות, נטושה! באבנים ובאגרופים ובילקוטי־הספרים… פעם אחת בבוקר התיצבה פה, בשער, אשה נוצרית זקנה, כבת שמונים ומעלה, וחיכתה עד בוש. בראותה לבסוף איש בא מירכתי החצר (זה היה אחד המורים של בית־הספר, יהוּדי “מערבי” צעיר, במשקפים), צעדה לקראתו כל עוד כוח בה ודיברה רתת:

– דבר נחוץ לי אליך, אדוני. אמור נא לי, מתי מטיף הרבינר בטמפּל.

אני רוצה לשמוע. היתנו לי להיכנס?.. אשה יראת אלוהים אנכי, פרוטסטנטית אדוקה, ואין כנסיה, שלא התפללתי בה, ואין כומר, אשר לא שמעתי את הדרשה שלו. והנה זה כמה לילות שאני שומעת קול לוחש באזני: היכנסי פעם לטמפּל הישראלי ושמעי גם אל דרשת הרבינר בטרם תמותי…
",התחיה,1930
גרשום שופמן ,דמעות,"בשלוש הדירות, בקומה השניה, יושבים: הפסנתרן, רווק בא בימים; מימינו – האשה האלמנה, לבנת־השׂער ומרת־הנפש, אשר, באחרוֹ לנגן בערב, היא דופקת לו על כתלו שיחדל, וממולו, דלת מול דלת – האשה הגרמנייה, שזה לא כבר נתאלמנה מבעלה היהודי אף היא.

כוח נשים רענן מקרינה זו האחרונה סביבותיה, בצאתה ובבוֹאה (כבת ארבעים ומעלה), אבל הוא, הקומפוזיטור (כמה משירי הארץ מוּשרים בנגינתו), שוטם אותה. היא מסבירה פניה, מחייכת, אבל ניכר שאין תוכה כברה. זה כעשר שנים היא יושבת עמנו ואינה עמנו! את שתי בנותיה הרכות בשנים “שילחה החוצה”, כלומר, חיזקה את ידיהן לצוד להן שני חיילים אוסטרליים וללכת אחריהם, כתום המלחמה, אל ארצם. בתקוה שסוף־סוף תקחנה בנותיה אלה גם אותה אליהן, היא סובלת לפי שעה את בדידותה כאן באורך־רוח.

את מעוֹנה המפואר אין היא עוזבת כמעט; מזירה עצמה מבתי־קפה, מקולנוע וכו', כחוסכת את התענגותה בשביל החיים החדשים, השמורים לה שם. פעמיים ביום היא יורדת בכסוּת־בית אל תיבת־הדואר וחוזרת ועולה במדרגות לאט, שקועה כולה בקריאת המכתבים מאוסטרליה.

ולא ניחא לו למוסיקאי שעה שהוא תופס את עצמו ב“חולשתו”. בכל ישותו הוא עוֹין את האשה הזאת, ואף על פי כן הוא נוהה בחשאי אחרי קולה הצלוּל, הנגיני. בימי האזעקות היה נעים לו להזדמן עמה במקלט האפלולי; ועתים היא גונבת את לבו בשירוּת־מה, כגון בזה שהיא מצלצלת ומוסרת לו את המפתח שהשאירוֹ נעוץ בתיבת־הדואר למטה, וכדומה.

גם יש שהיא מעכבתוֹ על המדרגות ומספרת לו ממה שבנותיה כותבות לה. בימים הראשונים הודיעו אלה על חייהן גדולות ונצורות; ברם, עכשיו יש להכיר בין השיטין שהדברים יגעים שם, והסיכוּיים לנסיעתה נעשו קלושים ביותר. והימים חולפים בינתים ונותנים בה אותותיהם. קומתה שחה והילוּכה כבד.

רק עמו בלבד היא באה במגע קל מפּקידה לפקידה, ואילו משאר הדיירים היא מסתייגת מאוד ונזהרת לנפשה, שלא לבוא עם הנשים לידי התנגשות כלשהי. אינה מגיבה אם מי מהן תופסת את חדר־הכביסה שלא לפי התור; אינה מתרעמת על חיבוט השטיחים ממעל לראשה, וכיוצא באלה. כולה ותרנוּת והבלגה, כמי שנמצא ב“גלות”. מה לעשות?!

והנה קרה מקרה ופיה הכשילה. נער־הקרח העלה, כמשפטו יום יום, את שלושת ה“בלוקים” והטילם בין שלושת הדיירים, שעמדו בפתחיהם. פתאום הוכיחה את שכנתה לבנת־השער:

– אַת נוטלת לך תמיד את ה“בלוק” הגדול ביותר!

האלמנה מרת־הנפש, ששנאה כבושה בלבה אל שכנתה זו עוד מהיום הראשון לשבתה פה, השיבה לה קשות, נתרתחה יותר ויותר, עד שהטיחה בפניה:

– עוד תוכלי לשמוע מפי מלים אחרות!..

הגרמניה התחלחלה, התמוטטה, וכנרדפת על צואר “פלשה” למעון־המוסיקאי הפתוח, צנחה לתוך כורסה וגעתה בבכיה.

נבוך ואובד־עצות – דמעות מעבירות אותו על דעתו – טרח הפסנתרן לשדל ולהרגיע את האשה, אשר נמצאה פתאום בצל קורתו, דיבר על לבה וגם העביר אצבעותיו על קדקדה, שכבר התחיל מאפיר, העביר דרך רפרוף – הלא אומנותו בכך! – נוגע ואינו נו",התחיה,1930
גרשום שופמן ,האם,"להרגיש את האם, את האם בגילויה הכי ענוג, הכי נעלה, להרגיש את האמהי –האלוהי, ניתן רק אז, אם חולה־אהבה אתה על הבת, והיא, האם, אשת חן וראויה לאהבה אף היא, סוככת בכנפה על כל הענין, חרדה עליו וגם תומכת בו עד כמה שידה, יד אֵם מגעת, וכל זה במין מסירות מופלאה, בהקרבה עצמית מסתורית ונוגעת עד הלב מאוד.

עם אֵם כזאת זכיתי אנכי פעם לבוא במגע.

בבוקר, אחרי ליל־סיוטים, ממחרת הריב־הפירוד הראשון, התהלכתי בחדרי, התלבטתי מפינה אל פינה, ופתאום צלצול: האֵם!…

מה חפצתי לנפול על צוארה! הלב ניחש טובות. סוף־סוף היא האם, ובידה, כביכול, המפתח… והריהי מדברת:

–… לא באתי לפשר, לא באתי לתווך, אבל… אינך צריך לשכוח, כי עודנה תינוקת, עוד לא מלאו לה שבע־עשרה שנה… אין לך שום יסוד ל“רוגז”… שובה אלינו, שובה!…

אבל השלום, כשלום הבין־לאומי, תלוי בשערה. לא ארכו הימים, ושוב סכסוך ושוב חשד ושוב פירוד ושוב אי־שינה, דכאון כבד מנשוא, ושוב, כמלאך מושיע, האם בבוקר:

– איני מתכוונת לפשר, איני מתכוונת להשלים, אבל… איני יכולה לראות בצרת נפשה… בכתה כל הלילה…

וכך חזרו הדברים חלילה. שלום זמני ו“ברוגז” וציפיה לאם, שלום וברוגז וציפיה לאם.

בביתם לא פסקה אצלי המתיחות המציקה, הידועה כל כך לחולי־אהבה. התרוצצתי מחדר אל חדר, מחדר הבת אל חדר האם וחזרה. עתים, כשהיא, האֵם, הרגישה בי קדרות כלשהי, שאלה בחיוך:

– מה, שוב לא טוב?…

והיו בו, בחיוכה היפה (אגב עצימת עינים), גם ניחומים גם אבק־לגלוג, ויחד עם אלה גם מעין קורת־רוח דקה מן הדקה, נחת אֵם מפרי בטנה: הנה איזה כוח לה, לקטנה!…

ככה פירפרה הנפש הפצועה והתרפקה עליה, על אמה, על האם הענוגה, שריח־היולדת בה עוד לא נמר, וחתרה לחסות בצלה, להשתפך אל חיקה ולחלק עמה את הכל, את הרעות ואת הטובות; וזו נענתה, נענתה והשתתפה באלה כבאלה בכל עדנתה האמהית.

באחד הערבים אצתי אל חדרה ולחשתי לה:

– הנני מאושר!…

לתמהוני, לא נהרו פניה הפעם כמשפטה ברגעי “אָשרי” הקודמים. לא נהרו פניה. בספקנות הציצה בי, בספקנות. הכבר ידעה את הסוד?… כך, לפעמים, מתלהב חולה אנוש לקראת רופאו: “אני חש את עצמי עכשיו טוב מאוד!” בה בשעה שהרופא יודע, כי ימיו ספורים.

וכן היה. כעבור ימים אחדים אחרי ה“אושר” בא הפירוד הסופי. כמו מן המארב זינקה האמת בכל אכזריותה, בכל עריתה, ונעשה ברי: הפעם גם האם לא תוכל להציל לא תוכל! כלתה הרעה! קץ!

עזבתי את הנערה לנפשה באמצע הרחוב, בשעת צהרים, והלכתי נכחי מבולבל, כושל, כהולך על פני רעידת אדמה… חסל!!

ונס לא נתרחש. עברו ימים, שבועות, והאם לא יספה בוא עוד. חדשים – ואיננה. הנה צעדים במדרגות מתקרבים ועולים – וצלצול… במעון הסמוך.

לא תבוא, לא תבוא!

זמן רב עבר מני אז, וזה עשה את שלו. הנערה עצמה כבר דהתה, התנדפה, התאדתה, אבל אל פעמי האֵם עוד אזני נטויה… אם אלוהית, הרת־הצלה, העוד בוא תבואי, העוד בוא תבואי?!!
",התחיה,1930
גרשום שופמן ,הוא,"היותו הראשון ולו היה העָבר – לא ביטאו את שמו מפורש, אלא כינוהו הוא סתם. וגם הברה זו פלטו שניהם, הבעל ואשתו, על־כרחם, כאילו כפאם שד, אגב רהַט השיחה. לרגל ענין אחר. היא סיפרה, למשל, כיצד למדה את אמנות הגלישה, בעודנה נערה כבת חמש־עשרה; למדה ביסורים. בדמע.

– חבשתי את המחלקים לנעלי, והוא נהג אותי עד לאמצעיתו של הקרח, ושם עזבני לנפשי, בפעם הראשונה…

– מי? – שאל הבעל מתוך פיזור־הנפש.

– נו, הוא… – רטנה היא, כמתחרטת על כל הסיפור.

או שנימקה את פחדה מפני הברקים והרעמים וסיפרה. כיצד הפתיעה פעם הסערה, בשעת טיול מחוץ לכרך, ובקרבתה הכה הברק בצריף־איכרים לעיניה.

– לבדך היית אז?

– לא…

– לא!..–סנט בה בצחוק רע וחיקה את קולה.

– ובכן למה אתה שואל?!

על־דבר הדם, שזינק מתוך גרונה פעמַים בחייה. סיפרה וחזרה וסיפרה פטפטנית תמימה זו, שיצורי־המות הקטנים והערמומיים כירסמו את ריאתה המתוקה בתאוה יתירה. היאך ששכבה לבדה בחדרה ושמעה את הרופא מתלחש עם בני ביתה בחדר השני…

– והוא בכה כל־כך, כל־כך בכה!…

– מי?

– נו, הוא…

ובדמיון הבהיק כפעם־בפעם אותו הפרצוף החיור והרזה, הזרוּע נקודות־חמה, שאך פעם אחת ראהו, הפרצוף הסלַוי הקר וחד המשטמה. הוא – העשוק, האויב המסוכן, שלא יחמול ביום־נקם…

– אילו היה זה אחר, לפחות, – הוכיח אותה פעם. – הלא בין ידידי־נעוריך היו נערים נחמדים כל־כך, והנה דוקא הוא, המכוער שבהם!..

היא שתקה.

עתים, כשהלכה אל השוק לקנות דבר־מה, נעל בעדו את הדלת והתחיל מפשפש רתת בכל המגירות, בכל כיסי בגדיה, בין הדפים של תוי־הנגינה שלה. תאות־הריגול תקפתהו כל־כך, עד שכמעט נצטער, על שחוץ מכרטיסי־טראם ישנים וממועכים לא מצא כלום.

אחר־כך טייל בחדר אחת הנה ואחת הנה, הביט אל החלונות, ולפתע־פתאום נזדעזע, התלבש בבהילות ויצא אף־הוא.

מבולבל שוטט ברחובות, קפץ מטראם אל טראם, פנה כה וכה, הביט ותר. והימים ימי הקְרַמְפּוּס; מתוך חלונות־הראוה מציצים השדים־הבובות האדומים כלפי שלג החוץ.. לבסוף הוא שם נפש בכף והולך אל אותו בית־הקפה, ששם יושב הוא, נדחק ונכנס דרך הדלת המסתובבת, ותיכף משקפיו מתערפלים מפני החום ואין הוא רואה כלום לחלוטין. מוכה סנוורים הוא מפקיר את עצמו ביד גורלו – מאד אפשר, שברגע זה יתנפל עליו הוא באקדח או בסכין…

ומה שלא מצא בהקיץ, ראה בחלומותיו, החלומות, החלומות!… כמה ערמומיות־שטנים הוצקה בהם; איזה יגון, איזה דוחק נפש! והיא היתה כאן לא כפי שהיא עכשיו. אלא דוקא כבימים הראשונים, בראשית קסמה וכוחה. מורתח כולו ומלא חמת־נקם ננער והציץ תיכף עליה, ששכבה לצדו, שקועה בשנתה ופיה פעור קצת, ושוב הצטער רגע אחד, על שאין זה אלא חלום ואינו יכול איפוא לבצע בה את נקמתו.

מתוך חלום שכזה הקיץ פעם אחת בבוקר־סתיו ומצא אותה לתמהונו, כשהיא נשענת על מרפקה, וראשה משורבב אל מחוץ למיטה, כלפי קרקע. לבו ניבא לו לא־טובות, והוא שאל ברחמים גדולים:

– מה לך, סַבּינקה?

מבלי הביט עליו, ככועסת, השיבה מלה אחת:

– דם!

הוא לא ידע מה לעשות והתחיל מתלבש. חלוקו נדמה לו כהה ביותר… לבוש למחצה תמכה בראשה, הביט על הנוזל האדום, שפרץ בלי מעצור, נאנח בכל ישותו ומילמל:

– אלה הם החיים! אלה הם החיים!..

כמו בשכבר הימים, ברוצו, ילד בן־תשע, לקרוא אנשים אל אמו הגוססת, כן רץ עכשיו לאורך הרחוב – אל הרופא. עין בעין כלפי האסון הגדול אנו נעשים כולנו שוב ילדים בני־תשע. “הוא בכה כל־כך, כל־כך בכה!” ומתוך כל העולם הגדול והזר, שוה־הנפש, הבהיק עתה אך אחד, חיור ורזה, כידיד יחידי, כאח, שנוטל עליו את חצי הכאב, כאֵב־הרחמים הנורא – הוא.
",התחיה,1930
