שם מלא,שם סיפור,הסיפור,תקופה,שנה
גרשום שופמן ,Persil,"זהו שם אבקת־כּיבּוּס חדשה של פירמה עשירה, שלסוגי תוצרתה השונים היא עושה פרסום בכל האמצעים שבעולם ואינה חסה לשם כך על הון עצום. בין הסוכנים הרבים, שחזרו על הפתחים וניירות־רקלמה ל“פרסיל” זה בצקלונם, היה גם משורר אחד.

כן, על השירה לבדה קשה לחיות, ועל כרחו הוא נוטל על עצמו עניני־חולין כאלה, שאותם הוא מוצא לרוב בחלק המודעות של עתוני הבירה. רק רע הדבר, שעסקים אלה מכניסים מעט, ויגיעה ושעמום עמהם הרבה.

ביום תמוז לוהט אחרי הצהרים, לאחר שדפק כמעט על כל דלתות הבתים של פרבר הכרך, לתוצאות וללא תוצאות, יצא המשורר־הסוכן אל השדה הקרוב, הטיל את עצמו על הדשא, התפרקד והתחיל מביט בצמא אל טוהר השמים.

השמים, השמים! הלא בשלהם, בשל השמים הללו, באה לו כל זאת. יותר מדי חי בשמים – על כן נחשל בּארצי; אל כן התנקם בו הארצי. אם כי, מאידך, יש לנוד לאחרים, לארציים, על שאינם יודעים את ההתלהבות, שמרעיף עליו תמיד תהום־תכלת זה, מעמיק־הנשימה. הנה כי כן טוב, לפחות, ששטח עליון זה לו הוא; טוב, לפחות, שכאן, בשמים, בשמיו, אין מקום לעסקים, לפירמות, לסוכנות ולאבקות־כיבוס!

והנה… מה זה?! כעין ראש־נחש צחור הוטל שם פתאום, זחל, התפתל, התמתח, ו – אות, אותיות... יד נעלמה כותבת בשמים… רגע אחד חלפו הרהור: התגלות, התגלות אלוהית לו, קרבן־השמים, בתור פיצוּי ושילומים… ברם, האכזבה הנוראה לא איחרה לבוא: אוירון חג וכתב על גבי התכלת בגז צחור מלה ענקית אחת, מלה, שתפסה את רבע הרקיע כמעט – Persil .",התחיה,1930
גרשום שופמן ,vatar,"
ביוהרה מיוחדת אוהבת היתה קיטי, בת הארבע־עשרה, להטעים קריאה זו, בפנותה אל אביה, בעל המסבאה, הנס קיזלינגר, כדי שהאורחים הזרים, שהיא משמשת אותם, ישמעו וידעו שאין היא כאן נערה משרתת־מלצרית, אלא הבת. הימים הטובים עוד היו במדינה. האנשים ישבו אל השולחנות הארוכים וסבאו יין ובירה ולא שעו בדברי “פוליטיקה”, הם ונשיהם וילדיהם. ניבול־הפה עבר כל גבול… עד שקיטי, בעצמה ילדה קטנה עדיין, קיטרגה:

– לוּ, לפחות, לא היו ילדים נוכחים כאן!.. כן, עוד שלום ושלוה מסביב. אשת המוזג, אף־על־פי שבת ישראל היא, חיבה יתירה נודעה לה מצד כל בני הפרבר, והקצב המגושם אלואיס וגנר, כטוב לבו ביין, שׂם ידו העקובה מדם על ירכה ברגע שזו העמידה לפניו את הכוס המלאה. והיא אף היא לא כיהתה בו הרבה, אלא סנטה: – כלום ביער אנחנו?!

ברם, האידיליה לא ארכה הרבה. רוחות חדשות התחילו מנשבות, ואת מקום ההלצות הגסות וניבול־הפה תפסו ה“פוליטיקה” והשטנה על היהודים. הקצב וגנר שוב לא שלח ידו אל המוזגת! בשארית כוחותיו נאבק הקנצלר, קטן־הקומה, עם הנחשול הנאצי עד שנפל חלל. פעמיים נפל: קודם הרגו הבריונים אותו גופו ואחר־כך ניתצו את האנדרטה שלו. וזה שבא אחריו, איש תואר, נכנע סוף־סוף אף הוא. בן־לילה השתלט צלב־הקרס, ודגליו הענקיים התנפנפו בבוקר ברוחות הרעות, הטמאות, הקטלניות. ברקיע־השמים הופיעו, להקות להקות מטוסי ה“רייך”, מסומנים בצלב־הקרס אף הם; אלה ניסרו וטירטרו וזימזמו בלי הפוגות, בלי הפוגות.

ימים קשים הגיעו לקיטי. חברותיה התחילו מתנכרות אליה, והאחת הנאמנה לה, מוכרחת היתה להתנצל לפני האחרות בדיאלקט השטיירי שלה: – הלא רק “האַלברטה” (יהודיה למחצה) היא!.. לבסוף בגדה בה גם זו, והיא נשארה לבדה, לבדה. אבל הנה קמה עליה רעה מביתה, רעת־הרעות: אביה נעשה פתאום נאצי קנאי אף הוא, אף הוא, והפירוד בינו ובין אשתו בוצע באופן ברברי. ככה נסתחפו גם שתיהן, היא ואמה, בגורל המשותף לכל בני גזען.

התחילו הריצות והפרכוסים ממשרד למשרד לשם סידור הניירות ורשיון היציאה. ושם, במשרדים הממשלתיים, יושבים הפקידים החדשים, איש איש וצלב־הקרס בדש בגדו, וברוּמוֹ של כותל, ממעל להם, כבר סולקה תמונת הקנצלר העדין, האציל, ובמקומה קבוע דיוקנו של “המנהיג” על כל תיעובו, על כל הזוועה שבו… הממונה על סידור הדרכיות הסתכל בה באשה וקבע בקול את סימני פרצופה ורשם בתעודה: החוטם ישר, צבע העינים שחור, שער־הראש.. מכסיף. ורק עכשיו נתחוור לה לעצמה, כמה סבלה במשך כל הימים והלילות הללו, כמה סבלה!

ברגע האחרון, בתא הרכבת, ההולכת לטריאסט, הופיע הנס קיזלינגר במדי ס.א., ומבלי הביט לצד האשה, ניגש אל בתו ונשק לה על פיה ושב ויצא. כהרף עין נתרחש הדבר. בעד האשנב הוציאה ראשה הנערה המזועזעת וצעקה אחריו: Vater!… והרכבת זזה.


כחולמת היא מתהלכת כאן, בעיר החוף – זרה, בודדה, מקשה להתאקלם. לא מזמן מתה עליה אמה, וסופה שהיא, קיטי, נכנסה לבית זר כמשרתת, מה שלשעבר, בבית־אביה, לא חפצה, שהאורחים הזרים יחשבוה לשכזו בטעות. בפרצופה מבליח משחק שני היסודות הגזעיים, העוינים זה את זה, ונפתוליהם. היאבקות פנימית, חשאית, גנוזה־גנוזה, לפני ולפנים; דו־קרב בנושא אחד. חיוך טוב יש לה בשביל החיילים הנכרים, המשוטטים ברחובות. גם לערבי הצעיר, המשכים לפתח גבירתה, עם הפירות והירקות, היא מסבירה פנים; זה מלחית לרגליה ותוחב לה, בתור תוספת חינם, שני תפוחי־זהב גדולים לתוך שני כיסי סינרה, אחד מזה ואחד מזה.

עתים, בשבתות, מוליכות אותה רגליה אל המושבה הגרמנית, ושם היא מטיילת לאט במשעול הצר, לאורך הגדר, ומציצה לתוך החצר פנימה. ארוכות־ארוכות היא מסתכלת בתרנגולות, טובות־המראה, על גבי ערימת הזבל, וסופגת בצמא את הקריאה הממושכת של התרנגול האדום הגדול, הבריא, החסון. עד שהשוטר היהודי, על משמרתו, נוזף בה מרחוק על שהיא מתעכבת כאן ומתקרבת אל הגדר יותר מיד.

געגועים על אביה ניעוֹרו בה בימים האחרונים. במיוחד תוקפים אלה אותה במקלט, בין אזעקה לארגעה, בראותה את בנות גילה מתרפקות על הוריהן. והנה פעם, עם חצות, בליל ירח, לא היתה האזעקה בכדי: זמזום רחוק־רחוק, דק־מן־הדק, קלטה האוזן מבעד ללהג הרב. “שקט!”… “אלה הם לא שלנו – זמזום זר”… אותו הזמזום – מאז, משם. הוא הוא! ברי: האויב חג עכשיו ממעל לראשינו. והנה… נפלה פצצה בסמוך־בסמוך והרעידה את האדמה ואת הבית. הנשים צווחו באנחה והבנות נשתלבו־נצמדו נערה נערה בזרוע אביה ומתוך כל זאת בקעה ועלתה צעקת קיטי, צעקה־קריאה, בה פחד־מות וסילוּד־פגישה נָשָקו: Vater!.. –",התחיה,1930
גרשום שופמן ,אבי תמרה,"מרחוק, מארץ אחרת, באו הלום. שׂבע נדוּדים, חרוּש קמטים וטרוד ומטורד הבליח לנגד העינים אבי הבית, מבלי השתתף בענינים ה“רוחניים” של אשתו וילדיו. כזר. ואנו הרווקים, האורחים ה“מעניינים”, הסתובבנוּ כאן, בין עציצי הפרחים, דרך חירות, אכלנו ושתינו, הקשבנו אל הפסנתר והתרפקנו בתוך כך על הקטנה, בת העשר – על תמרה.

בהרות־שמש מלבבות היו לה על חטמה המופלא, עניבה אדומה בראשה, וכפות ידיה לא מעולם זה. אצבעותיה התנועעו בלי הרף, התמתחו, התפשקו, וכמו פרטו תמיד על כלי מוסיקה בלתי־נראים. נשמת הבית היתה תמרה. – תמרה חיורת היום כל כך… – העיר פעם האב בדאגה עצורה.

לא הציצה אליו. כי מי ישעה עתה אל איש המעשה הפשוט, האפור, כשהבית מלא אורחים נפלאים כאלה. הרי הוא, האב, אינו אלא אחד מני אלף, תלתן באפר, גרגיר חול. והנה החליטו פתאום, לצערנו הרב, לנדוד גם מכאן, כלעומת שבאו (אולי נתכוון האיש להיפּטר מאתנו?…). כולנו ליוינו אותם עד בית הנתיבות ולפנים ממנו, אל הרכבת, ואף נכנסנו לקרון. לא נמצאו מקומות פנויים – ואבי המשפחה נדחק, נלחם, הניף והטיל את הארגזים והמזודות הכבדים על המדפים העליונים, וסוף סוף, לאחר שכבר הצליח לכבוש לו פּינה, לא נתקררה דעתו, אלא יצא לבקש תא אחר, נוח יותר.

סבלים, שריקות, קיטור. פתאום זעה הרכבת, כאומרת להפליג, בהירתק אליה קרונות נוספים. – היכן אבא, היכן אבא?!.. – נבהלה תמרה, מבלי השגיח בנו כלל, ותבך.

רצנו לחפּשו, והוא צץ לקראתנו מן התוהו־ובוהו – קורן, קדוש, קברניט, אב, אב גדול, אבי תמרה.
",התחיה,1930
גרשום שופמן ,אביב,"על פרשת שבילים, ברפש השלגים הפושרים, פגשתי את יוּרי. הפגישות עם הזקן היוגוסלוי הזה, בן השמונים, ההולך יחף תמיד, גם בחורף, נעימות לי ביותר. כשריד “הגויים” הזקנים של ילדוּתנו – בפיקת גרגרתו הצחיחה, בריח יין השרף הנודף מפיו, בעל השן הכתומה האחת, וביחוד המלה “דוֹבּרֶה”, שבה הוא מתבל תכופות את להגו הגרמני, מלה שבכל הכפר השטַירי הזה אני הוא היחידי, היודע פירושה. כמנהגו התחיל משתחווה נמוכות וקורא:

— גנֶדיגר הֶר!…

כסבור הייתי, שימשיך את פזמונו הנצחי: “אשתי היא אשה רעה מאד, אשתי היא אשה רעה מאד” וכו' (הכל יודעים, שאשתו בת הששים, שבודאי היא חושבת עצמה לעומתו צעירה יותר מדי, מסתוללת בו, בבעלה הזקן, באכזריות נוראה, וגזירה היא מלפניה, שיהא דר ברפת, עם הבהמות, ולא בבית), אבל לא! הפעם מלים אחרות בפיו:

— אדוני רב־החסד, השמוע שמע, איזה אסון קרני אתמול? אשתי מתה! כן, אדוני, אשתי מתה, ועתה רע, רע לי מאד. עתה אין אפילו מי שיבשל את ארוחת־הצהרים, לא טוב היות האדם לבדו!

— אבל, יוּרי, ניחמתיו, הלא תוכל לקחת לך עתה אשה אחרת. בכפר ישנן נערות הרבה כל כך, כל נערה ונערה תלך אליך בחשק. הלא יש לך בית וגן!

חיכיתי שיתחיל מתחטא בנוסח הידוע: איזו נערה תאבה ללכת אלי, אל שכמותי?! והנה הוא עונה דוקא:

— כן, זה אמת, אבל אני כבר מפחד מפני האשה. אשתי שמתה היתה אשה רעה מאד.

— מה אתה סח! קח, קח לך נערה בת שמונה־עשרה.

— ובכן, שאקח לי נערה, אומר אדוני? אולי אשמע בקולו באמת. דוֹבְּרֶה.

עיניו התכולות, בנות השמונים, התחילו קורנות בזוהר לא מעולם זה – ואני חשתי פתאום את האביב כאשר לא חשתיו מעודי.",התחיה,1930
גרשום שופמן ,אביבה,"מעדות המזרח הירושלמיות מוצאה. בין חמישים לששים (גם בגיל זה ישנן “אביבות”!). מה מספר שנותיה בדיוק אינה יודעת בעצמה. שתי צמות מדולדלות. יחפה. חיוּת רבה בעיניה ובחיתוך דיבוּרה. את מחיתה היא מוצאת כעוזרת בבתים שונים.

בבוֹאה: “מה שלומכם?” ותיכף היא יוצאת אל הגזוזטרה ומתחילה בחיבוּט המזרנים והשטיחים. את עבודתה הקשה בניקוי ובכיבוס היא עושה ללא התאמצות יתירה, וניכר שתוכל להמשיך בכך עד זיקנה מוּפלגת. כטבע הסבלים הזקנים, ששוּב אינם מרגישים בסבלותיהם.

בצריף רעוּע, בין יפו לתל־אביב, היא יושבת, ובימי ההפגזות וההפצצות סיפרה על כל האימים והזוועות שעברו עליה אמש. אבל לבה לא נפל. תופסת היא את גודל הימים ומתימרת בו. אזעקה כי נשמעה פתאום, ירדה למקלט אחרונה, ירדה לאט, וכאן לא התערבה בשיחות הנשים הפטפטניות, אלא ישבה לה באחת הפינות, בדֵלה ומכונסת בתוך עצמה.

בבתים, אצל נותני עבודתה, יש כל מיני דאגות וצרות, והיא, עוזרת קשישה זו, מביאה עמה תמיד הרגעה ועידוּד, ואפילו בעניני “פכים קטנים”. הנה משׂיחה בעלת־הבית לפניה את צערה על ספל־חרסינה נאה, שנפל מידה היום ונשבר.

ארבע־עשרה שנה היה לי הספל הזה, ואני כל כך אהבתיו. רק ממנו, מספל זה, שתיתי תמיד. מספל אחר איני טועמת בקפה שוּם טעם. ארבע־עשרה שנה – והנה היום נפל מידי ונשבר!

– בא הזמן… – מנחמת אביבה פילוסופית.

הרי זו סבתא ישראלית מהמין המשובח, העתיק. ועל כן, כשזו אינה באה לפעמים ביום הקבוע, אומרת האשה בצער:

– אביבה לא באה היום. ודאי עוד לא שבה מירושלים. כי בכל יום ששי היא נוסעת אל בנותיה הנשואות, היושבות בעיר־הקודש, בה נולדה וגדלה, ובה, לפי דבריה, היא מכירה כל אבן ואבן. אחרי סילוּק הערבים חזרה מלאה התלהבות וסיפרה הרבה על טיוליה עם בנותיה וחתניה בעיר ובסביבה.

הכל שם עכשיו שלנו. אנו לבדנו. אין ערבים, אין. היינו בעין־כרם, ושם שתיתי מים קרים, מתוקים, ישר מן ההר. יופי!!",התחיה,1930
גרשום שופמן ,אבישג,"אותה חזיתי בילדותי בדמות אסנה בת בייניש הנפּח, היפה בבנות הפרבר. שחרחורת ויעלת־חן וכתמים כהים תחת עיניה המלבבות. עד בלי די ניגד ועיצב הנפח את הברזל המלובן עד שיצא הקרדום או הפרסה. כבתו כמעשה־ידיו – בתכלית השלמוּת.

אכן, לא היתה כאסנה “נערה יפה בכל גבול ישראל”, ואני ראיתיה בדמיוני, כיצד היא משרתת את המלך בסינרה הלבן, בבוא אליו בת־שבע לבקש אשר ביקשה.

לא פיללתי אז, כי יש יום ואני אהיה במולדתה, בשונם. כן, בשונם ממש.

לא בשמים היא! רק כמהלך שעה ממרחביה. אני הולך בלוית חבר, ששבילי הארץ נהירים לו, ותר אחרי עקבות עבדי דויד הנאמנים, שהלכו בשעתם בדרך זו עצמה, ברצותם להנעים לו למלך את ימיו האחרונים. שדות צחיחים, שחומי רגב, מזה ומזה. האם גלו מכאן כל קסמי הנוף יחד עם אבותינו? פה ושם, בצדי הדרך, משחירים סימנים של שריפת־קוצים. שיחי צבר, צבר־ענק. והנה שונם!..

סימטה עקלקלה בין בתי־אבן קטנים, אטומים, נעדרי חלונות. צבר ואבן וילדים וילדים וילדים. ובאמצע, על גג בית נמוך, עומדת אבישג ותולה כבסים על חבל… היא היא!

דמיוני לא הטעני. קלסתר־הפנים הוא של אסנה בת־הנפּח. אותם הכתמים הכהים תחת העינים המחייכות, אם כי ארשת זרה קצת לעינים אלה והן שחורות יותר. בבת־אחת טולטלתי הרחק־הרחק חזרה. קול פטיש במפחה אני שומע. הנה היא מדדה יחפה על גבי הגרוטות, מתקרבת אל אביה העושה במלאכה, ונחילי גצים אופפים אותה. והנוף בחוץ במלוא תפארתו. קשת בענן ורסיסי גשם על הדשא והכל שמור בעינו, בעינו, בכבודו הראשון – יחי המלך!",התחיה,1930
גרשום שופמן ,אבן גדולה מהארץ,"שני הידידים מותיקי הישוב טיילו בחולות שבין הקיבוץ הצעיר והקטן ובין הכפר הערבי, שנתרוקן מיושביו, חשו בהנאה את המדינה תחת רגליהם, והאחד העיר: – בכל זאת טוב היה אילו היתה ארצנו גדולה קצת יותר… ברגע זה זימזם כדור מעל לראשם בלוית קול־יריה. אחריו שני, שלישי… – כדורים תועים הם אלה מיריות־אימונים אשר במושב הסמוך – עמדו על הדבר, ושניהם התכופפו וחתרו להגיע בהליכה לא נוחה זו, ראשם כבוש בקרקע, אל צלע הגבעה הקרובה, ששם ימצאו מחוץ לשטח הסכנה. רק כששים מטר לפניהם – ואיזה מרחק! והם הרגישו פתאום: “אכן, גדולה הארץ – ואנחנו לא ידענו!”",התחיה,1930
