שם מלא,שם סיפור,הסיפור,תקופה,שנה
תקוה שריג,האם הוא טלה או גור כלבים,"מַעֲשֶׂה בְּאָדָם אֶחָד לַמְדָן, גָּדוֹל בַּתּוֹרָה,

שֶׁלֹא חָלְקוּ לוֹ כָּבוֹד כְּפִי שֶׁהָיָה רוֹצֶה.

חָשַׁב הַלַּמְדָן בְּלִבּוֹ:

 - מַה לִּי, כִּי אֶלְמַד תּוֹרָה

בַּיָּמִים וּבַלֵּילוֹת,

אִם אֵין חוֹלְקִים לִי כָּבוֹד?

מוּטָּב שֶׁאֶהְיֶה סוֹחֵר עָשִׁיר, גְּבִיר,

יִצְטָרְכוּ הָאֲנָשִׁים לְעֶזְרָתִי

וְיִתְּנוּ לִי כָּבוֹד.


יוֹם אֶחָד, עָרְכוּ חַכְמֵי תּוֹרָה סְעֻדָּה

וְהִזְמִינוּ גַם אֶת הַלַּמְדָן.

בָּא אֵלִיָּהוּ הַנָּבִיא לְאוֹתָה סְעֻדָּה בִּדְמוּת רוֹעֶה

וְשָׁאַל אֶת הַחֲכָמִים, שֶׁיָּשְׁבוּ מִסָבִיב לַשֻּׁלְחָן, שְׁאֵלָה:

 - אֶתְמוֹל רָאִיתִי בָּעֵדֶר שֶׁלִּי כִּבְשָׂה אַחַת, הָעוֹמֶדֶת לְהַמְלִיט.

הַבֹּקֶר בָּאתִי לִרְאוֹת אֶת הַוָּלָד,

וְהִנֵּה הוּא דוֹמֶה לְגוּר כְּלָבִים.

הַאִם הוּא טָלֶה, אוֹ גוּר כְּלָבִים?

אָמְרוּ לוֹ הַחֲכָמִים:

 - אִם לֹא רָאִיתָ בְּעֵינֶיךָ, שֶׁהַכִּבְשָׂה הִמְלִיטָה וָלָד זֶה –

אֵינֶנּוּ טָלֶה וּבְשָׂרוֹ אָסוּר לַאֲכִילָה.

אָמַר אוֹתוֹ לַמְדָן לְאֵלִיָּהוּ, שֶׁבָּא בִּדְמוּת רוֹעֶה:

 - לֵךְ וְתֵן לִפְנֵי הַוָּלָד מַיִם.

אִם יְלַקֵּק אֶת הַמַּיִם בִּלְשׁוֹנוֹ, הוּא גוּר כְּלָבִים,

וְאִם יִשְׁתֶּה אוֹתָם בִּשְׂפָתָיו – הוּא טָלֶה.

אָמַר לוֹ אֵלִיָּהוּ הָ“רוֹעֶה”:

 - כְּבָר עָשִׂיתִי נִסָּיוֹן זֶה פַּעֲמַיִם.

פַּעַם שָׁתָה בִּלְשׁוֹנוֹ וּפַעַם בִּשְׂפָתָיו!

אָמַר לוֹ הַלַּמְדָן:

 - לֵךְ וּרְאֵה, אֵיךְ הוּא מַשְׁתִּין.

אִם יָרִים רַגְלוֹ הָאַחַת וְיַשְׁתִּין – הוּא גוּר כְּלָבִים

וְאִם יַשְׁתִּין וְאַרְבַּע רַגְלָיו עוֹמְדוֹת – הוּא טָלֶה.

אָמַר לוֹ אֵלִיָּהוּ הָ“רוֹעֶה”:

 - כְּבָר רָאִיתִי אֵיךְ הוּא מַשְׁתִּין.

פַּעַם הוּא מֵרִים אֶת רַגְלוֹ הָאַחַת

וּפַעַם – אַרְבַּע רַגְלָיו עוֹמְדוֹת…

אָמַר לוֹ הַלַּמְדָן:

 - לֵךְ וְהַשְׁלֵךְ אוֹתוֹ מֵרֹאשׁ הַגַּג.

אִם יִקְפֹּץ עַל רַגְלָיו – הוּא טָלֶה,

אִם יֵאָחֵז בְּצִפָּרְנֵי רַגְלָיו וְלֹא יִקְפֹּץ –

הוּא גוּר כְּלָבִים.

אָמַר לוֹ אֵלִיָּהוּ הָ“רוֹעֶה”:

 - גַּם זֹאת עָשִׂיתִי כְּבָר.


pic. 3.png

פַּעַם קָפַץ עַל רַגְלָיו

וּפַעַם אָחַז בְּצִפָּרְנֵי רַגְלָיו.

אָמַר לוֹ הַלַּמְדָן:

 - זֹאת עֲשֵׂה: שְׁחַט אוֹתוֹ

וְשִׂים נֵתַח מִבְּשָׂרוֹ עַל הָאֵשׁ.

אִם יִתְפַּשֵּׁט הַבָּשָׂר וְיִשָּׁאֵר חָלָק –

הוּא גוּר כְּלָבִים, וּבְשָׂרוֹ אָסוּר לַאֲכִילָה

אִם יִצְטַמֵּק וְיִתְקַמֵּט –

הוּא טָלֶה, וּבְשָׂרוֹ מֻתָּר.

אָמַר אֵלִיָּהוּ הַנָּבִיא הָ“רוֹעֶה” בְּקוֹל גָּדוֹל

וְהָיוּ כָּל הַחֲכָמִים מַקְשִׁיבִים לִדְבָרָיו:

- אַשְׁרֵיכֶם, שֶׁלַּמְדָן גָּדוֹל בַּתּוֹרָה כָּזֶה יוֹשֵׁב בְּתוֹכְכֶם.

תְּנוּ לוֹ כָּבוֹד וְהוֹשִׁיבוּהוּ בְּרֹאשׁ הַשֻּׁלְחָן,

כָּרָאוּי לְחָכָם כָּזֶה!

רָאוּ הַחֲכָמִים, כִּי נְכוֹנִים דִּבְרֵי הָ“רוֹעֶה”,

שָׂמוּ אֶת הַלַּמְדָן נַשִׂיא עֲלֵיהֶם

וְנָתְנוּ לוֹ כָּבוֹד גָּדוֹל,

וְכָל זֹאת בִּזְכוּתוֹ שֶׁל אֵלִיָּהוּ הַנָּבִיא,

זָכוּר לַטּוֹב.
",ספרות עברית חדשה,1967
תקוה שריג,ארנון מגלה את סודה,"גַּם הַפַּעַם קָרְאוּ לָהּ הַיְלָדִים “שְׁמֵינֶה בּוֹבֶּה”

וְשׁוּב הָיְתָה יַלְדָּה אַחַת שֶׁלִּטְּפָה רַךְ־רַךְ אֶת לַאסִי

בְּבִטְנָהּ. זוֹ כְּבָר לֹא הָיְתָה רוּתִי, שֶׁכְּבָר גָּדְלָה וְהָלְכָה

לְבֵית־הַסֵּפֶר. עַכְשָו הָיְתָה זוֹ צַפְרִירָה שֶׁהָיְתָה עוֹד

קְטַנְ־קְטַנְטַנָּה – אוּלַי בַּת שָׁלֹשׁׁ, וְלֹא יָדְעָה עוֹד אֲפִלּוּ

לְדַבֵּר כָּל־כָּךְ טוֹב, וְאָמְרָה כָּל הַזְּמַן: – לַאסִי’לֶה

חַמוּדָה’לֶה, אוֹפוֹ הַגוּרִים מִבֶּטֶן שֶׁלָּךְ?

יוֹם בָּהִיר אֶחָד, נֶעְלְמָה לַאסִי וְאֵינֶנָּה! הַיְלָדִים

חִפְּשׂוּ, חִפְּשׂוּ וְלֹא מָצְאוּ, וְהָיוּ עֲצוּבִים מְאֹד. גַם סוֹנְיָה

וְרִבְקָה, הַיּוֹדְעוֹת לְהָשִׁיב עַל כָּל לָמָּה וּמַדּוּעַ,

אֵיפֹה וּמָתַי, אָמְרוּ הַפַּעַם, שֶׁהֵן בֶּאֱמֶת אֵינָן

מְבִינוֹת, מַה קָּרָה לְלַאסִי…

מִי גִּלָּה לְבַסּוֹף אֶת לַאסִי? אַרְנוֹן!

הוּא קָם הַשְׁכֵּם־הַשְׁכֵּם בַּבֹּקֶר, וְהָלַךְ לִפְתֹּחַ אֶת

הַפִּשְׁפָּש בַּחֲצַר הַלּוּל. עָשָׂה זֹאת כָּל יֶלֶד שֶׁקָּם

הָרִאשׁוֹן בַּבֹּקֶר. פּתְאֹם שָׁמַע יִלּוּל חַלָּשׁ, חַלָּשׁ.

חִפֵּשׂ פֹּה, חִפֵּשׂ שָׁם – לְחִנָּם. הֵרִים אַרְנוֹן שָׁלֹשׁ בֵּיצִים

לְבַנְבַּנּוֹת שֶׁמָּצָא בַּלּוּל, בְּתָא הַהֲטָלָה, וְרָצָה לְהַכְנִיס

אוֹתָן הַבַּיְתָה. פִּתְאֹם, כְּשֶׁהִגִּיעַ לַדֶּלֶת, שָׁמַע עוֹד פַּעַם

אֶת הַיִּלּוּל הַזֶּה וְהַפַַּעַם – קְצָת יוֹתֵר חָזָק!

הָלַךְ צַעַד וּשְׁנַיִם, וְהִנֵּה רָאָה מִתַּחַת לַמִּשְׁטָח,

בַּפִּנָּה, בְּדִיּוּק לְיַד הַדֶּלֶת, חֹר, וּמִתּוֹכוֹ עוֹלֶה הַקּוֹל.

פִּתְאֹם נִזְכַּר אַרְנוֹן בְּדָבָר שֶׁסּוֹנְיָה אָמְרָה פַּעַם

לַיְלָדִים:

– יֵשׁ כְּלָבוֹת הַחוֹפְרוֹת לָהֶן חֹר, אוֹ בּוֹר,

וּמַמְלִיטוֹת שָׁם.

הוּא נִכְנַס לַבַּיִת בְּשֶׁקֶט, בְּשֶׁקֶט, הִנִּיחַ בָּאָרוֹן

אֶת שְׁלֹש הַבֵּיצִים, מִלֵּא קַעֲרַת חֲלָב מִן הַכַּד

בַּמְקָרֵר, יָצָא וְהֶעֱמִיד בִּזְהִירוּת אֶת הַקְּעָרָה עַל יַד

הַבּוֹר. הוּא הִתְחַבֵּא רָחוֹק מִשָּׁם וְהִסְתַּכֵּל בְּסַבְלָנוּת

מַה יִּקְרֶה. אֵיזֶה יֶלֶד נָבוֹן הָיָה זֶה אַרְנוֹן!

כַּעֲבֹר כַּמָּה רְגָעִים, בְּאֱמֶת הֵצִיץ מִשָּׁםהָרֹאשׁ

הַצְּהַבְהַב, בַּעַל הָאָזְנַיִם הָאֲרֻכּוֹת, שֶׁל לַאסִי, וְהִיא

לִקְּקָה בִּמְהִירוּת, גָּמְרָה חַת־שְׁתַּיִם אֶת כָּל הֶחָלָב,

הֵצִיצָה כֹּה וָכֹה וְנֶעְלְמָה לָהּ בַּחֹר שֶׁמִּתַּחַת לַמִּשְׁטָח.

עַכְשָׁו, כְּבָר לֹא יָכֹל אַרְנוֹן לְהִתְאַפֵּק, נִכְנַס

לַבַּיִת וְקָרָא בְּקוֹלֵי־קוֹלוֹת:

– יְלָדִים, יְלָדִים! לַאסִי הִמְלִיטָה בַּבּוֹר, מִתַּחַת

לַמִּשְׁטָח! אֲנִי שָׁמַעְתִּי אֵיךְ הַגּוּרִים שֶׁלָּהּ מְיַלְּלִים שָׁם

וַאֲפִלּוּ נָתַתִּי לָהּ חָלָב!

זֶּה הָיָה מֻצְלָח מְאֹד, שֶׁסוֹנְיָה בָּאָה בְּדִיּוּק בְּאוֹתוֹ

רֶגַע, וְאָמְרָה לַיְלָדִים שֶׁלֹּא יִגְּשׁוּ אֶל לַאסִי, כִּי אוּלַי

הִיא עַצְבָּנִית וִיכוֹלָה לִנְשֹׁךְ. אַחֶרֶת, מִי יוֹדֵעַ מֶה הָיָה

קוֹרֶה… סוֹנְיָה הִבְטִיחָה לַיְלָדִים לֵאֱפוֹת לָהֵם עוּגָה

לְהֻלֶּדֶת הַגּוּרִים. תָּמִיד אוֹפִים אֶצְלֵנוּ עוּגָה לַמִשְׁפָּחָה

שֶׁנּוֹלַד לָהּ תִּינוֹק חָדָשׁ.

הַיְלָדִים הִתְאַפְּקוּ וְלֹא נִגְּשׁוּ. רַק הַיֶּלֶד שֶׁהֵבִיא

לָהּ אֹכֶל, הָיָה נִגָּשׁ בְּשֶׁקֶט גָּמוּר, מַעֲמִיד לָהּ אֶת

הַקְּעָרָה, הוֹלֵךְ לוֹ לְאֵיזֶה מַחֲבוֹא לִרְאוֹת מֵרָחוֹק מַה

יִּקְרֶה, כְּמוֹ שֶׁעָשָׂה אַרְנוֹן, הָרִאשׁוֹן.

כְּשֶׁהִתְחִילָה לַאסִי לָצֵאת מִדֵּי־פַּעַם מִן הַחֹר,

הָיְתָה נוֹבַחַת עַל כָּל עוֹבֵר וָשָׁב שֶׁלֹּא הָיָה מֵהַהוֹרִים,

אוֹ מִבְּנֵי מִשְׁפַּחְתָּם שֶׁל יַלְדֵי גַּן ד'. אֵיךְ הִכִּירָה אֶת

כֻּלָּם? בְּאֱמֶת זֶה פֶּלֶא!

מִשֶּׁגָּדְלוּ הַגּוּרִים וּפָקְחוּ עֵינַיִם, יָצְאוּ מֵחֹרָם, וְלַאסִי

הִרְשְׁתָה לַיְלָדִים לְשַׂחֵק עִמָּם. אַבָל אוֹי וַאֲבוֹי הָיָה

לְכָל אָדָם זָר שָׁנִּגַּשׁ לַמִּשְׁטָח. לַאסִי הָיְתָה נוֹבַחַת

וּמִסְתָּעֶרֶת עָלָיו. לְרֹב הַחֲבֵרִים לֹא הָיָה אֹמֶץ לֵב

אֲפִלּוּ לְהִתְקָרֵב לַגַּן. אוֹרֵחַ עַז־נֶפֶשׁ הָיָה מְבַקֵּשׁ מֵאַחַד

הַיְלָדִים שֶׁיִּתֵּן לוֹ יָד וְיִשְׁמֹר עָלָיו. לַאסִי הָיְתָה

רוֹטֶנֶת, אַךְ הָאוֹרֵחַ הָיָה נִכְנָס וְיוֹצֵא בְּשָׁלוֹם.


זְמַן־מָה לִפְנֵי חֲלֻקַּת הַגּוּרִים, כְּבָר עָזְרוּ רִבְקָה

וְסוֹנְיָה לְלַאסִי לְהֵינִיקָם. אֵיךְ?

בֹּקֶר אֶחָד, שָׁלְחָה סוֹנְיָה אֶת גִילָה לְבֵית

הַתִּינוֹקוֹת, לְבַקֵּשׁ מִשָּׁם בַּקְבּוּק עִם פִּטְמָה. הִיא שָׁלְחָה

אָמְנָם רַק אֶת גִּילָה, אֲבָל כָּל יַלְדֵי הַגַּן הָלְכוּ בִּשְׁיָרָה

וְלִוּוּ אוֹתָהּ לְשָׁם וַחֲזָרָה, כְּשֶׁבְּיָדָהּ הַבַּקְבּוּק הַוָּרֹד

וְהַיָּפֶה מִפְּלַאסְטִיק, עִם הַפִּטְמָה הָרַכָּה וְהַמַּבְרִיקָה.

סוֹנְיָה יָצְקָה לְתוֹךְ הַבַּקְבּוּק חָלָב פּוֹשֵׁר, מְמֻתָּק,

וְעָזְרָה לְלַאסִי לְהֵינִיק אֶת הַגּוּרִים.

ארנון סוף.png
לְאַט־לְאַט, הִתְרַגְּלוּ כָּל הַגּוּרִים לִינוֹק מֵהַבַּקְּבְוּק.

רַק אֶחָד לֹא רָצָה בְּשׁוּם אֹפֶן בַּקְבּוּק וְדָבַק רַק

בָּאִמָּא שֶׁלּוֹ. לַגּוּר הַזֶּה קָרְאוּ פִּינוֹקְיוֹ, כִּי רַעְיָה

אָמְרָה שֶׁהוּא מְפֻנָּק, מְפוּנְדְרָק.

כְּשֶׁגָּדְלוּ הַגּוּרִים, הִתְחִילוּ סוֹנְיָה וְרִבְקָה לְחַלֵּק

בְּכָל יוֹם גּוּר לְחָבֵר אַחֵר, כְּמוֹ שֶׁעָשׂוּ בַּפַּעַם הַקּוֹדֶמֶת.

וְלַאסִי – שׁוּב הִשְׁתּוֹלְלָה. הִיא רִחְרְחָה וְחִפְּשָׂה

בְּכָל הַבַּיִת וְהֶחָצֵר…

הִיא לֹא זָזָה מֵהַמָּקוֹם וְשָׁמְרָה עַל הַגּוּרִים

הַנּוֹתָרִים.

מִכָּל הַגּוּרִים, נִשְׁאֲרוּ לָהּ בַּסוֹף, רַק פִּינוֹקְיוֹ וְצַחִי

הַלָּבָן. לַאסִי נִרְגְּעָה. הִיא לֹא נָבְחָה יוֹתֵר.


שׁוּב אָהֲבָה אֲנָשִׁים. בְּיִחוּד אֲנָשִׁים קְטַנִּים, יְלָדִים.

וְעַכְשָׁו נַשְׁאִיר אֶת אִמָּא לַאסִי בִּמְנוּחָה וּבְשֶׁקֶט

שֶׁהִיא מְאֹד אוֹהֶבֶת, וְנִשְׁמַע סִפּוּר חָדָשׁ.
",ספרות עברית חדשה,1975
תקוה שריג,בכי טוב,"כְּשֶׁהַקְּטַנְטַנִּים בְּגַן ה' גָּדְלוּ כְּבָר קָצת,

וְהָיוּ אוּלַי בְּנֵי שָׁלוֹשׁ, אוֹ שָׁלוֹשׁ וָרֶבַע, אָמְרוּ

הַגְּדוֹלִים לְשִׁפְרָה:

– אוּלַי כְּבָר נַעֲשֶׂה פַּעַם מַחֲנֶה בַּגְּבָעוֹת?

הֲלֹא עֲנָת, יוֹנִי, חָנָן וְרָמִי כְּבָר דֵּי גְּדוֹלִים, וְהֵם

יְכוֹלִים כְּבָר לַעֲשׂוֹת מַחֲנֶה!

כָּכָה הֵצִיקוּ יוֹם יוֹם לְשִׁפְרָה, עַד שֶׁבֹּקֶר בָּהִיר אֶחָד, אָמְרָה לָהֶם:

– טוֹב! בְּסֵדֶר, נֵצֵא לַמַּחֲנֶה, מָחָר בַּבֹּקֶר הַשְׁכֵּם!

הַיְלָדִים הִשְּׁתּוֹלְלוּ מִשִּׂמְחָה, צָחֲקו וְקָרְאוּ

קְרִיאוֹת חֶדְוָה, וּבִן-רֶגַע נֶעְלְמוּ: הֵם רָצוּ לְחַדְרֵי הַהוֹרִים

לְהַשִּׂיג תַּרְמִילִים, מֵימִיּוֹת, אוֹלָרִים, שְׂמִיכוֹת וּשְׁאָר

אֲבִיזָרִים נְחוּצִים.

צִלָּה אָמְרָה, שֶׁעוֹד לֹא רָאֲתָה יְלָדִים

מִתְלַבְּשִׁים כָּל כָּךְ מַהֵר וְיָפֶה, כְּמוֹ הַיְלָדִים הָאֵלֶּה

בְּבֹקֶר הַמַּחֲנֶה. בִּן חֲצִי-רֶגַע, הָיוּ כֻּלָּם מוּכָנִים, שָׁתוּ

סֵפֶל חָלָב, וּכְבָר רָצוּ לְשַׁעַר הַדִּיר, בַּדֶּרֶךְ לַגְּבָעוֹת.

הַגְּדוֹלִים רָצוּ הָרִאשׁוֹנִים, בְּשִׁירָה וְצָהֳלָה עִם צִלָּה,

וְהַקְּטַנִּים וְהַקְּטַנְטַנִּים, שֶׁאָמְנָם כְּבָר קְצָת גָּדְלוּ,

נִסְחֲבוּ מֵאָחוֹר עִם שִׁפְרָה.

הַיָּמִים יְמֵי אָבִיב. הַכֹּל פָּרַח מִסָּבִיב.

מִדְרוֹנוֹת הַיַּעַר בָּעֲרוּ בְּלַהֲבוֹת חַרְצִיּוֹת צְהֻבּוֹת.

בָּעֵמֶק לְמַטָּה, נָצְצוּ בְּרֵכוֹת הַדָּגִים בְּכָל הַשְּׁטָחִים.

וְהַפַּרְדֵּס הַיָּרֹק קָרַץ מֵרָחוֹק. שִׁפְרָה הָלְכָה לָהּ בְּנַחַת,

כְּשֶׁהִיא נוֹשֵׂאת סַל אֹכֶל בְּיָדָהּ הָאַחַת וְכַד גָּדוֹל, מָלֵא

מִיץ, בְּיָדָהּ הַשְּׁנִיָּה. הַקְּטַנִּים הָלְכוּ סְבִיבָהּ,

כְּאֶפְרוֹחִים סְבִיב הַדּוֹגֶרֶת. בְּכָל רֶגַע גִּלָּה מִישֶׁהוּ מֵהֶם

תַּגְלִית חֲדָשָׁה וְהִכְרִיז עָלֶיהָ בְּקוֹלֵי קוֹלוֹת:

– שִׁפְרָה, מָצָאתִי תּוֹלַעַת!

– שִׁפְרָה, מָצָאתִי קַרְנַיִם שֶׁל אַיִל!

– יְלָדִים, אֲנִי מָצָאתִי חִפּוּשִׁית זֶבֶל!

הֵם כְּבָר עָבְרוּ אֶת הַדִּיר, וְשִׁפְרָה הִסְתַּכְּלָה

בִּקְצָת דְּאָגָה עַל הַמֶּרְחָק הַהוֹלֵךְ וְגָדֵל בֵּינֵיהֶם לְבֵין

הַיְלָדִים הַגְּדוֹלִים, שֶׁהָלְכוּ עִם צִלָּה, שֶׁכְּבָר הִגִּיעוּ עַד

– מַה זֶּה קָרָה שָׁם?

– לָמָּה הֵם מִסְתּוֹבְבִים וּמְנִיעִים אֶת הַיָּדַיִם לְכָל הַצְּדָדִים?

– הַבּיטוּ, כּוֹבָעִים עָפִים בָּאֲוִיר! וְתַרְמִילִים!

פִּתְאֹם שָׁמְעָה צַעֲקוֹת יֵאוּשׁ שֶׁל צִלָּה:

– שִׁפְרָה, בּוֹאִי מַהֵר – רִים! רִים!

שִׁפְרָה לָא הִצְלִיחָה לִשְׁמֹעַ מַה צָּעֲקָה לָהּ

צִלָּה בְּדִיּוּק, אֲבָל רָאֲתָה שֶׁכֻּלָּם שָׁם רוֹקְדִים

וּמְקַפְּצִים, צוֹעֲקִים וּמְנַפְנְפִים בַּיָּדַיִם כִּמְטֹרָפִים. לֹא

הִסְפִּיקָה לִסְפֹּר עַד שְׁתַּיִם, וְהִנֵּה הִתְחִילָה הִיא בְּעַצְמָהּ

לְנַפְנֵף בַּיָּדַיִם וְכָל


לנפנף בידים וכל.png

הַקְּטַנִּים פָּרְצוּ בְּזַעֲקוֹת אֵימִים:

אִמָּא’לֶה! אַבָּא’לֶה! שִׁפְרָה’לֶה! קִבַּלְתִּי עֲקִיצָה!

נְחִיל דְּבוֹרִים נוֹצֵץ וְעוֹקֵץ שָׁטַף בִּיעָף

וְהִסְתַּבֵּךְ בֵּין הַיְלָדִים הַצּוֹרְחִים, כְּשֶׁהֵם רָצִים בְּכָל

כֹּחָם לְהִמָּלֵט מִפָּנָיו, מְנַפְנְפִים בַּיָּדַיִם, וּבוֹעֲטִים

בָּרַגְלַיִם. אֵיכְשֶׁהוּ נֶחְלְצוּ כֻּלָּם בִּמְרוּצָה וְהִגִּיעוּ

לַפַּרְדֵּס. שָׁם עָמְדוּ בַּתּוֹר לִפְנֵי שִׁפְרָה וְצִלָּה,

שֶׁשָּׁלְפוּ בִּזְרִיזוּת אֶת הָעֳקָצִים מֵהַיְלָדִים הַבּוֹכִים.

כֻּלָּם בָּכוּ. בְּכִי כָּזֶה עוֹד לֹא נִשְׁמַע מֵעוֹלָם בְּגַן

שִׁפְרָה.

מֹשֶה’לֶה הָיָה הָרִאשׁוֹן שֶׁנִּרְגַּע, כְּמוֹ תָּמִיד.

עִם שְׁתֵּי אָזְנַיִם אֲדֻמּוֹת כְּכַלָּנִיּוֹת, הִסְפִּיק לְחַטֵּט

וּלְגַלּוֹת אֶשְׁכּוֹלִיּוֹת שְׁכוּחוֹת, בְּתוֹךְ אַחַד הָעֵצִים. הוּא

הֵבִיא אוֹתָן לְ“מִרְפָּאַת הָעֳקָצִים” וְקָרָא בְּקוֹל גָּדוֹל:

– מִי שֶּׁלֹא יִבְכֶּה יְקַבֵּל מִמֶּנִּי אֶשְׁכּוֹלִית!

אֲבָל רַק מִי שֶׁלֹּא יִבְכֶּה בֶּאֱמֶת! לְאַט, לְאַט, נִתְפַּיְּסוּ

הַיְלָדִים הַקְּטַנִּים וְשָׁתְקוּ – אֲפִלּוּ לִפְנֵי הַגְּדוֹלִים. הֵם

לָקְקוּ וּמָצְצוּ אֶת פִּלְחֵי הָאֶשְׁכּוֹלִיּוֹת הַצּוֹנְנִים,

כְּשֶׁהֵם מְגָרְדִים בְּשֶׁקֶט אֶת הָעֲקִיצוֹת שֶׁלָּהֶם,

מִסְכֵּנִים.

הַמַּחֲנֶה בָּאַמְפִיתֵאַטְרוֹן נִגְמַר בִּבְכִי טוֹב…

עוֹד אֵיזֶה בֶּכִי! לַמָּחֳרָת, הָיָה זֶה גַּן אֲבַטִיחִים וְלֹא גַּן

יְלָדִים. כֻּלָּם הָיוּ נְפוּחִים וּמַצְחִיקִים כְּבַלּוֹנִים. הֲכִי

הֲכִי


נפוחים ומצחיקים.png

מַצְחִיקוֹת הָיוּ צִלָּה וְשִׁפְרָה! בִּכְלָל לֹא רָאוּ

לָהֶן אֶת הָעֵינַיִם! לַמַּחֲנֶה הַזֶּה קָרְאוּ יָמִים רַבִּים בְּגַן

שִׁפְרָה “מַחֲנֵה הָעֲקִיצוֹת”, אֲפִלּוּ הַיְלָדִים שֶׁכְּבָר יָצְאוּ

מֵהַגַּן וְלָמְדוּ כְּבָר מִזְּמַן בְּבֵית הַסֵּפֶר, עוֹד זָכְרוּ

וְסִפְּרוּ כָּל נִפְלְאוֹתָיו.

גַּם עַל זֶה אֶפְשָׁר לָשִׁיר אֶת הַפִּזְמוֹן שֶׁל

יוּסוּף! נָא לְהַכִּיר: אִם רַק יוֹדְעִים אַתֶּם אֶת הַמַּנְגִּינָה שֶׁל

“פַּעַם אַחַת בָּחוּר יָצָא אֶל הַכְּבִישׁ” – כְּבָר יְכוֹלִים לָשִׁיר

תֵּכֶף וּמִיָּד, פָּשׁוּט כָּךְ: (רַק אַל נָא תִּשְׁכְּחוּ שֶׁלְּגַן

שִׁפְרָה קוֹרְאִים גַּם: גַּן ה').


פַּעַם אַחַת גַּן ה' יָצָא הֵם עָבְרוּ עַל-יַד הַדִּיר

לַשָּׂדֶה! בְּשִׂמְחָה!

פַּעַם אַחַת גַּן ה' יָצָא הֵם עָבְרוּ עַל-יַד הַדִּיר,

מַחֲנֶה לַעֲשׂוֹת רָצָה וְהִתְחִלוּ כְּבָר לָשִׁיר


הָיָה זֶה בֶּעָבָר, הָיָה זֶה בֶּעָבָר,

הָפַךְ לְשֵׁם דָּבָר! הָפַךְ לְשֵׁם דָּבָר!


כְּבָר הִגִּיעוּ לַפַּרְדֵּס, עָבְרוּ עַל יַד הַכַּוָּרוֹת

עוֹד מְעַט! בְּשִׁירָה!

כְּבָר הִגִּיעוּ לַפַּרְדֵּס עָבְרוּ עַל יַד הַכַּוָּרוֹת,

אָז קָרָה לָהֶם הַנֵּס וְהִתְחִילָה דְּהָרָה


הָיָה זֶה בֶּעָבָר, הָיָה זֶה בֶּעָבָר,

הָפַךְ לְשֵׁם דָּבָר! הָפַךְ לְשֵׁם דָּבָר!


הַדְּבוֹרִים חִישׁ הִתְנַפְּלוּ הַבַּיְתָה הֵם מִיָּד הָלְכוּ

עַל כֻּלָּם! בְּרִיצָה!

הַדְּבוֹרִים חִישׁ הִתְנַפְּלוּ, הַבַּיְתָה הֵם מִיָּד הָלְכוּ,

וְהַיְלָדִים אָז יִלְּלוּ, לְמָחֳרָת, הוֹי, הִתְנַפְּחוּ,


הָיָה זֶה בֶּעָבָר, הָיָה זֶה בֶּעָבָר,

הָפַךְ לְשֵׁם דָּבָר! הָפַךְ לְשֵׁם דָּבָר!",ספרות עברית חדשה,1975
