שם מלא,שם סיפור,הסיפור,תקופה,שנה
תקוה שריג,אדם כלבו וחמורו,"לְאָדָם אֶחָד הָיָה כְּלַבְלָב,

מִפִּתּוֹ אָכַל, בְּחֵיקוֹ שָׁכַב,

עִמּוֹ הָלַךְ, עִמּוֹ רָכַב.

קִנֵּא בּוֹ הַחֲמוֹר וּבְלִבּוֹ חָשַׁב:

בַּמֶּה נוֹפֵל אֲנִי מִן הַכְּלַבְלָב

הַנּוֹבֵחַ בַּיוֹם וְגַם בַּלֵּיל, הַב-הַב?

אֵלֵךּ גַּם אֲנִי אֶל אֲדוֹנִי, וְכָמוֹהוּ

אֲחַבְּקֵהוּ, אֲנַשְּׁקֵהוּ, בִּלְשׁוֹנִי אֲלַקְּקֵהוּ!

אָשִׂים עֵינַי אֶל מוּל עֵינָיו

אָשִׂים פָּנַי אֶל מוּל פָּנָיו

וּכְכָל שֶׁהַכֶּלֶב יִנְבַּח הַב-הַב,

אֶנְעַר אֲנִי בְּאָזְנָיו…


כָּךְ חָשַׁב וְגַם עָשָׂה,

כַּאֲשֶׁר אֲדוֹנוֹ לְבֵיתוֹ פָּסַע.

וְכֹה הִרְבָּה הַחֲמוֹר בְּבֵיתוֹ לְהַקִּפוֹ, עַד כִּי מִכִּסְאוֹ, עָלָיו יָשַׁב – הֲדָפוֹ.

קָרָא הָאִישׁ רֵעָיו לְעֶזְרָה, לְהַצִּילוֹ מִן הַצָּרָה הַצְּרוּרָה.

וַתִּקָּהֵל כָּל הַקְּהִלָּה, בְּחִפָּזוֹן וּבֶהָלָה גְּדוֹלָה,

זֶה בְּרֹמַח וְזֶה בְּמַקֵּל, וְזֶה בַּאֲבָנִים יְסַקֵּל,

עַד שֶׁשָּׁב הַחֲמוֹר אֶל דִּירוֹ, מֻכֶּה וּמוּבָס מִזְּנָבוֹ וְעַד צַוָּארוֹ.


וַאֲשֶׁר סֻפַּר עַד כֹּה, הוּא הַמָּשָׁל וְזֶהוּ נִמְשָׁלוֹ:

קִנְאָה וְצָרוּת-עַיִן

רָעָה גְּדוֹלָה מֵהֶן אָיִן!",ספרות עברית חדשה,1979
תקוה שריג,אהבת התמר והתמרה,"מַעֲשֶׂה בִּתְמָרָה שֶׁגָּדְלָה עַל שְׂפַת יָם כִּנֶּרֶת,

שֶׁלֹּא עָשְׂתָה פֵּרוֹת שָׁנִים רַבּוֹת

וְהָיְתָה גְּדֵלָה וּמְתַמֶּרֶת אֶל עָל.

עָבַר דִּקְלַאי (מֻמְחֶה לַעֲצֵי תָּמָר) אֶחָד עַל פָּנֶיהָ וְאָמַר:

– תְּמָרָה זוֹ מִתְגַּעְגַּעַת לְתָמָר הַמְתַמֵּר בִּירִיחוֹ…

מַהֲרוּ וְהָבִיאוּ מִמֶּנּוּ אַבְקַת זֶרַע וּתְנוּ אוֹתוֹ עַל הַתְּמָרָה!

עָשׂוּ כִּדְבָרָיו וְנָתְנָה הַתְּמָרָה אוֹתָהּ שָׁנָה פֵּרוֹת רַבִּים

כְּכָל שֶׁעוֹשׂוֹת תְּמָרוֹת בְּשָׁנִים אֲחָדוֹת.

",ספרות עברית חדשה,1979
תקוה שריג,אוי לאותה עיר,"יוֹם אֶחָד, הִגִּיעַ הַמְשׁוֹרֵר הַיְּהוּדִי סְפָרַדִּי, רַבִּי אַבְרָהָם אִבְּן-עֶזְרָא,

לְעִיר אַחַת וּשְׁמָהּ ‘מוֹרָה’.

רָאָה אוֹתָהּ וְאֶת אֲנָשֶׁיהָ וְלֹא נָשְׂאוּ חֵן בְּעֵינָיו.

לִפְנֵי שֶׁיָּצָא מִמֶּנָּה, יָשַׁב וְכָתַב לְיוֹשְׁבֶיהָ חֲרוּזִים אֵלֶּה:

""הַקַּנְקַן רֵיקָן בְּלִי יַיִן

וְהַגְּבִינָה גְּנוּבָה, בְּלִי זַיִן

וְהַגְּבֶרֶת עִוֶּרֶת בְּלִי עַיִן

חִגֶּרֶת וְנִשְׁבֶּרֶת צָעֲדָה עֲלֵי עָיִן.

וְאַנְשֵׁי הַמָּקוֹם אֲחֵי-קַיִן,

וּמוֹתַר הָאָדָם (עַל הַבְּהֵמָה) אֲשֶׁר בּוֹ – אָיִן

אִם אֵין אֲנִי דָּר שָׁם – אָשִׂים בְּרֹאשָׁה הָעָיִן"".


מֶה הָיְתָה כַּוָּנַת הַמְשׁוֹרֵר?

אַנְשֵׁי הָעִיר ‘מוֹרָה’ הָיוּ ‘אַנְשֵׁי הֶבֶל’ (אֲחִי קַיִן) רָעִים וּפוֹחֲזִים,

מַאַכְלֵיהֶם וּמַשְׁקְאוֹתֵיהֶם חַסְרֵי טַעַם

וְכָל אֲשֶׁר בָּהּ ‘צוֹלֵעַ’ וּפָגוּם

וְעַל-כֵּן הֶחְלִיט הַמְשׁוֹרֵר, שֶׁבִּקֵּר בְּעִיר ‘מוֹרָה’,

לְהוֹסִיף בְּרֹאש שְׁמָהּ אֶת הָאוֹת ‘ע’,

וְכָךְ הָיָה שְׁמָהּ לַ’עֲמוֹרָה', כַּאֲחוֹתָהּ ‘סְדוֹם’

הֲלֹא הֵן הֶעָרִים הַתְּאוֹמוֹת, הַיְדוּעוֹת לְשִׁמְצָה: ‘סְדוֹם וַעֲמוֹרָה’.
",ספרות עברית חדשה,1979
תקוה שריג,אוי לאיש נולד בלי כוכב,"הַמְשׁוֹרֵר הַיְּהוּדִי-סְפָרַדִּי אַבְרָהָם אִבְּן-עֶזְרָא עָנִי מָרוּד הָיָה

וּמָצָא אֶת פַּרְנָסָתוֹ בְּבָתֵּי עֲשִׁירִים

שֶׁהָיָה מְחַבֵּר בִּשְׁבִילָם שִׁירִים לִמְסִבּוֹתֵיהֶם.

וְכָךְ שׁוֹרֵר עַל מַזָּלוֹ הָרָע:


""אַשְׁכִּים לְבֵית הַשַּׂר, אוֹמְרִים: ‘כְּבָר רָכַב’,

אָבוֹא לְעֵת עֶרֶב, אוֹמְרִים: ‘כְּבָר שָׁכַב’.

אוֹ יַעֲלֶה מֶרְכָּב, אוֹ יַעֲלֶה מִשְׁכָּב!

אוֹיָה לְאִישׁ עָנִי, נוֹלַד בְּלִי כּוֹכָב.""
",ספרות עברית חדשה,1979
תקוה שריג,אורחים שאינם רצויים,"אוֹרְחִים לְמָה הֵם דּוֹמִים? לִגְשָׁמִים.

תְּחִלָּה אָדָם שָׂמֵחַ לִקְרָאתָם וּמְקַבֵּל אוֹתָם בְּחִבָּה

וְאַחַר־כָּךְ, נַפְשׁוֹ סוֹלֶדֶת מֵהֶם.

הוּא רוֹצֶה שֶׁיֵּלְכוּ, וְהֵם עוֹמְדִים עַל עָמְדָם!

בַּיּוֹם הָרִאשׁוֹן, אָדָם שׁוֹחֵט לְאוֹרְחוֹ עֵגֶל;

בַּיּוֹם הַשֵּׁנִי – שֶׂה;

בַּיּוֹם הַשְּׁלִישִׁי – תַּרְנְגוֹל;

בַּיּוֹם הַרְבִיעִי הוּא מַגִּישׁ לְפָנָיו שְׁעוּעִית

וְכָךְ הוּא הוֹלֵךְ וּמַמְעִיט,

עַד שְׁקָּם וְהוֹלֵךְ לְדַרְכּוֹ…
",ספרות עברית חדשה,1979
תקוה שריג,איל חיל ואיל מת,"קוֹל אֶחָד לְאַיִל חַי,

וְשִׁבְעָה קוֹלְוֹת לְאַיִל מֵת…

כֵּיצַד?

שְׁתֵּי קַרְנָיו – חֲצוֹצְרוֹת;

שְׁתֵּי שׁוֹקָיו – חֲלִילִים;

עוֹרוֹ – תֹּף;

מֵעָיו הַגַּסִּים – מֵיתְרֵי הַנֵּבֶל;

מֵעָיו הַדַּקִּים – מֵיתְרֵי הַכִּנּוֹר;

כָּל קוֹל וְעוֹד קוֹל

וַהֲרֵי בְּיַחַד, שִׁבְעָה קוֹלוֹת",ספרות עברית חדשה,1979
תקוה שריג,אל תחטף!,"כְּשֶׁיָּרַד הַמָּן בְּמִדְבַּר סִינַי, לִבְנֵי-יִשְׂרָאֵל לְאָכְלוֹ,

מִהֲרוּ רַבִּים לַחְטֹף לָהֶם מָן כְּכָל שְׁיָּכְלוּ, חֳמָרִים, חֳמָרִים.

רָאָה מֹשֶׁה רַבֵּנוּ, שֶׁקְּטַנֵּי אֱמוּנָה הֵם בְּנֵי-יִשְׂרָאֵל, אָמַר לָהֶם:

לִקְטוּ מִמֶּנּוּ (מִן הַמָּן) אִישׁ לְפִי אָכְלוּ,

עֹמֶר לְגֻלְגֹּלֶת, (כְּ) מִסְפַּר נַפְשׁוֹתֵיכֶם,

(וְרַק) אִישׁ לַאֲשֶׁר בְּאָהֳלוֹ תִּקָּחוּ!

בָּדְקוּ חֲכָמִים וּמָצְאוּ שֶׁפָּסוּק זֶה בְּדִבְרֵי משֶׁה

מֵכִיל אֶת כָּל אוֹתִיּוֹת הא""ב,

לְלַמֶּדְךָ, כַּמָּה חֲשׁוּבָה הוֹרָאָה זוֹ,

שֶׁלֹּא לַחְטֹף!",ספרות עברית חדשה,1979
תקוה שריג,אלכסנדר מוקדון בממלכת הנשים,"אַלֶּכְּסַנְדֶר הַגַּדוֹל הָיָה תְּחִלָּה מֶלֶךְ מַקֵדוֹניָה שֶׁבְּאַסְיָה הַקְּטַנָּה.

לְאַחַר־מִכֵּן, כָּבַשׁ אֶת יָוָן וְאֶת כָּל הָאֲרָצוֹת שֶׁכָּבְשָׁה יָוָן תְּחִלָּה

וְעוֹד רָצָה לִכְבֹּשׁ אֲרָצוֹת וְעַמִּים חֲדָשִׁים.

פַּעַם אַחַת, הִקְהִיל אֶת כָּל חֲכָמָיו וְיוֹעֲצָיו וְאָמַר לָהֶם:

– רוֹצֶה אֲנִי לִכְבֹּשׁ אֶת אַפְרִיקָה! וְאַתֶּם אמְרוּ לִי, כֵּיצַד אַגִּיעַ לְשָׁם?

אָמְרוּ לוֹ:

– אִי אֶפְשָׁר! הָרֵי־הַחֹשֶׁךְ שֶׁגָּבְהָם עַד הַשָּׁמַיִם עוֹמְדִים לְךָ בְּדַרְכְּךָ!

אָמַר לָהֶם:

– לֹא שָׁאַלְתִּי אֶתְכֶם, אִם אֵצֵא לְאַפְרִיקָה וְאִם לֹא, אֶלָּא כֵּיצַד אַגִּיעַ לְשָׁם.

אָמְרוּ לוֹ הַחֲכָמִים:

– צַוֵּה וְיָבִיאוּ לְךָ שַׁיָּרָה שֶׁל חֲמוֹרִים לוּבִיִּים הָרְגִילִים לָלֶכֶת בַּחֲשֵׁכָה,

וְעוֹד צַוֵּה וְיָבִיאוּ לְךָ חֲבָלִים אֲרֻכִּים מְאֹד.

כְּשֶׁתֵּלְכוּ לְאַפְרִיקָה, מִתְחוּ הַחֲבָלִים לְאֹרֶךְ הַדֶּרֶךְ,

וּכְשֶׁתָּשׁוּבוּ, תֵּלְכוּ עַל פִּיהֶם.

עָשָׂה כָּךְ אַלֶּכְּסַנְדֶר מוֹקְדוֹן וְיָצָא לְאַפְרִיקָה.

הִגִּיעַ לִמְדִינַת קַרְתָּגָה, שֶׁשָּׁלְטוּ בָּהּ אָז רַק נָשִׁים.

רָצָה לְהִלָּחֵם בָּהֶן וְלִכְבֹּשׁ אֶת אַרְצָן.

יָצְאָה לִקְרָאתוֹ מִשְׁלַחַת שֶׁל נָשִׁים וְאָמְרָה לוֹ:

– אִם תִּלָּחֵם בָּנוּ, הַנָּשִׁים, יִצְחֲקוּ לְךָ בְּכָל הָעוֹלָם, וְאַף בַּדּוֹרוֹת הַבָּאִים לֵאמֹר:

“אַלֶּכְּסַנְדֶר מוֹקְדוֹן הַגָּדוֹל נִלְחַם בְּנָשִׁים!”

אָמַר לָהֶן:

– רוֹאֶה אֲנִי חָכְמָה בְּדִבְרֵיכֶן, אִם כֵּן, הוֹצִיאוּ לְפָנַי כִּכַּר לֶחֶם וְלֹא אֶלָּחֵם בָּכֶן.

(מִנְהָג עַתִּיק הוּא – הוֹצָאַת לֶחֶם לַכּוֹבֵשׁ – סִימָן לִכְנִיעָה)

הוֹצִיאוּ לְפָנָיו כִּכַּר זָהָב, שֶׁדָּמְתָה לְכִכַּר לֶחֶם,

תַּפּוּחִים עֲשׂוּיִים זָהָב וְרִמּוֹנִים עֲשׂוּיִים זָהָב

וְכָל זֹאת בִּקְעָרוֹת עֲשׂוּיוֹת זָהָב טָהוֹר.

אָמַר לָהֶן:

וְכִי אוֹכְלִים זָהָב אֶצְלְכֶן בְּקַרְתָּגָה, מַמְלֶכֶת הַנָּשִׁים?

אָמְרוּ לוֹ:

– וְכִי יָצָאתָ לְאַפְרִיקָה וּבָאתָ לְקַרְתָּגָה בִּשְׁבִיל כִּכַּר לֶחֶם?

וְכִי לֹא הָיָה לְךָ כִּכַּר לֶחֶם בִּמְקוֹמְךָ?

הִתְבַּיֵּשׁ אַלֶּכְּסַנְדֶר הַגָּדוֹל לְשֵׁמַע דִּבְרֵי הַנָּשִׁים הַחֲכָמוֹת.

וּכְשֶׁפָּנָה מִשָּׁם אַלֶּכְּסַנְדֶר לְדַרְכּוֹ, צִוָּה

עַל עֲבָדָיו לִכְתֹּב כְּתֹבֶת עַל שַׁעַר קַרְתָּגָה וְזוֹ

לְשׁוֹנָהּ:

""אֲנִי אַלֶּכְּסַנְדֶר הַגָּדוֹל, מֶלֶךְ מוֹקְדוֹן, שׁוֹטֶה הָיִיתִי

עַד שֶׁבָּאתִי לִמְדִינַת הַנָּשִׁים, הִיא קַרְתָּגָה,

וְלָמַדְתִּי מִפִּיהֶן חָכְמָה וְעֵצָה.""
",ספרות עברית חדשה,1979
תקוה שריג,אלכסנדר מוקדון והגלגלת,"פַּעַם, בְּאֶחָד ממסעות הַמִּלְחָמָה שֶׁלּוֹ יָשַׁב

אַלֶּכְּסַנְדֶר מוֹקְדוֹן עַל שְׂפַת נַחַל וְהִתְכּוֹנֵן לֶאֱכֹל דָּגִים

מְלוּחִים.

שָׁטַף אוֹתָם תְּחִלָּה בְּמֵי הַנַּחַל וְהִתְבַּשְּׂמוּ הַדָּגִים בְּרֵיחַ גַּן־עֵדֶן.

רָחַץ אֶת פָּנָיו בְּמֵי הַנַּחַל וְחָיְתָה רוּחוֹ וְכָל עֲיֵפוּתוֹ פָּגָה מִמֶּנּוּ.

נִתְמַלֵּא אַלֶּכְּסַנְדֶר סַקְרנָוּת, מֵהֵכָן נוֹבֵעַ נַחַל זֶה.

קָם וְצָעַד בְּמַעֲלֵה הַנַּחַל, אֶל מְקוֹרוֹ.

כְּשֶׁהִגִּיעַ לַמַּעְיָן, מָצָא שָׁם שַׁעַר נָעוּל.

דָּפַק עָלָיו אַלֶּכְּסַנְדֶר וְקָרָא:

– פִּתְחוּ לִי אֶת הַשַּׁעַר, אֲנִי אַלֶּכְּסַנְדֶר מוֹקְדוֹן!

אָמַר לוֹ קוֹל מִפְּנִים לַשַּׁעַר:

– זֶהוּ שַׁעַר גַּן־עֵדֶן וְרַק צַדִּיקִים יָבוֹֹֹאוּ בוֹ!

יָדַע אַלֶּכְּסַנְדֶר שֶׁאֵינוֹ צַדִּיק, וְלֹא יִפָּתַח לְפָנָיו שַׁעַר גַּן־עֵדֶן.

בִּקֵּשׁ: – אָמְנָם, צַדִּיק אֵינֶנִּי, אֲבָל מֶלֶךְ גָּדוֹל אֲנִי,

תְּנוּ לִי אֵפוֹא מַשֶּׁהוּ מִגַּן־עֵדֶן!

יָצְאָה מִן הַשַּׁעַר יָד וְהוֹשִׁיטָה לְאַלֶּכְּסַנְדֶר גֻּלְגֹּלֶת אָדָם.

כְּשֶׁשָּׁב אַלֶּכְּסַנְדֶר לְאַרְצוֹ וּלְאַרְמוֹנוֹ, הִנִּיחַ אֶת הַגֻּלְגֹּלֶת בְּכַף מֹאזנַיִם.

לָקַח אֶת כָּל כַּסְפּוֹ, זְהָבוֹ וְהָאֲבָנִים הַטּוֹבוֹת שֶׁלּוֹ וְהִנִּיחַ בַּכַּף הַשְּׁנִיָּה.

וְהִנֵּה לֹא הִכְרִיעוּ אֵלֶּה אֶת כַּף הַמֹּאזְנַיִם,

כִּי הָיָה מִשְׁקָלָהּ שֶׁל אוֹתָהּ גֻּלְגֹּלֶת מִגַּן־עֵדֶן גָּדוֹל יוֹתֵר.

קָרָא לְפָנָיו אֶת כָּל חֲכָמָיו וְשָׁאַל אוֹתָם מַה פֵּשֶׁר הַדָּבָר הַמּוּזָר הָזֶּה.

אָמְרוּ לוֹ הַחֲכָמִים:

– אִם יִקַּח הַמֶּלֶךְ קֹמֶץ עָפָר וִיכַסֶּה אֶת

פִּתְחֵי הָעֵינַיִם שֶׁבַּגֻּלְגֹּלֶת, מִיָּד יִהְיֶה מִשְׁקָלָהּ קַל,

כְּמִשְׁקַל עַצְמוֹתֶיהָ בִּלְבַד.

עָשָׂה אַלֶּכְּסַנְדֶר כְּדִבְרֵיהֶם וְנִמְצָא שֶׁצָּדְקוּ.

שָׁאַל אוֹתָם, מַדּוּעַ יָעֲצוּ לוֹ מַה שֶּׁיָּעֲצוּ וְהֵם הֵשִׁיבוּ לוֹ:

– עֵינָיו שֶׁל אָדָם, כָּל עוֹד אֵינָן שׁוֹכְנוֹת עָפָר,

לְעוֹלָם אֵינָן שְׂבֵעוֹת וְתָמִיד הֵן רוֹצוֹת עוֹד וְעוֹד, לָכֵן מִשְׁקָלָן גָּדוֹל.

רַק בְּמוֹתוֹ, כְּשֶׁמִּתְכַּסּוֹת עֵינָיו עָפָר, הֵן נַעֲשׂוֹת שְׂבֵעוֹת…
",ספרות עברית חדשה,1979
תקוה שריג,אם אין אני לי מי לי,"הָיֹה הָיָה כְּפָר אֶחָד בָּאָרֶץ, “קֶרֶן הַשֶּׁפַע” שְׁמוֹ.

הָיוּ בּוֹ אִכָּרִים אוֹהֲבֵי אַדְמָתָם

וְחָרוּצִים מֵאֵין כְּמוֹתָם.

הָיוּ מְסַקְּלִים, חוֹרְשִׁים, מְזַבְּלִים, זוֹרְעִים וְנוֹטְעִים

מַשְׁקִים וְעוֹדְרִים, מְנַכְּשִׁים וְזוֹמְרִים

וְרָאוּ בְּרָכָה בְּכָל מַעֲשֵׂי יְדֵיהֶם

וְאַדְמָתָם – כְּ“קֶרֶן-הַשֶּׁפַע”, הֲלֹא הוּא שֵׁם כְּפָרָם.

אָכְלוּ הָאִכָּרִים מִכָּל טוּב,

בָּנוּ לָהֶם בָּתִּים גְּדוֹלִים וְנוֹחִים,

וְלֹא שָׁמְרוּ דָּבָר מִכָּל אֲשֶׁר לָהֶם לְיוֹם צָרָה.

הָיָה בֵּינֵיהֶם אִכָּר אֶחָד

שֶׁחַי חַיֵי צִנְעָה בְּבַיִת קָטָן וּפָשׁוּט

וְכֵן הָיוּ גַּם בְּגָדָיו וּמְזוֹנוֹתָיו וְכָל דְּרָכָיו.

הָיָה הָאִכָּר שׁוֹמֵר בְּמַרְתְּפוֹ

שַׂקֵּי חִטִּים וְקִטְנִיּוֹת

כַּדֵּי שֶׁמֶן וּדְבַשׁ

וַעֲרֵמוֹת שְׂעוֹרִים לִבְהֶמְתּוֹ.

הָיוּ שְׁכֵנָיו צוֹחֲקִים לוֹ וְאוֹמְרִים:

קַמְצָן טִפֵּשׁ אַתָּה, שֶׁאַתָּה עָמַל כָּל הַיָּמִים
וְאֵינְךָ נֶהֱנֶה כָּמוֹנוּ מִיגִיעַ כַּפֶּיךָ!

אָמַר לָהֶם אוֹתוֹ אִכָּר:

“אִם אֵין אֲנִי לִי מִי לִי”…
הָיוּ מְלַגְלְגִים עָלָיו כָּל הַיָּמִים וּמְכַנִּים אוֹתוֹ ' אֲנִילִימִילִי'…


פַּעַם אַחַת, פָּקְדָה בַּצֹּרֶת קָשָׁה אֶת הָאָרֶץ

וּבְעִקְּבוֹתָיו – רָעָב וּמַחְסוֹר.

קָרָא הָאִכָּר הַצָּנוּעַ אֶת שְׁכֵנָיו לְבֵיתוֹ

וְחִלֵּק לָהֶם מִכָּל אוֹצְרוֹת הַמָּזוֹן שֶׁאָגַר בְּמַרְתְּפוֹ

וְאָמַר לָהֶם:

עַכְשָׁו אַתֶּם מְבִינִים מַה שֶּׁאָמַרְתִּי לָכֶם
“אִם אֵין אֲנִי לִי מִי לִי”?

וְעוֹד אֹמַר לָכֶם “וּכְשֶׁאֲנִי לְעַצְמִי מָה אֲנִי”?

וְכִי אֵשֵׁב לְבַדִּי וְאֹכַל כָּל מַה שֶּׁאָגַרְתִּי בְּמַרְתְּפִי

בְּעוֹד אַתֶּם נְמֵקִּים בָּרָעָב?!

הוֹדוּ לוֹ הַשְּׁכֵנִים מִכָּל לֵב,

וְחָקְקוּ דְּבָרָיו בְּזִכְרוֹנָם.

וְשׁוּב לֹא כִּנּוּ אוֹתוֹ בְּלַעַג “אֲנִילִימִילִי”.
",ספרות עברית חדשה,1979
תקוה שריג,אם תצמא למים בני,"שָׁנוּ רַבּוֹתֵינוּ, לְתַלְמִידֵיהֶם:

""– אִם יָצָאתָ לַדֶּרֶךְ, קַח עִמְּךָ כַּד שֶל מַיִם

וְלֹא תִּשְׁתֶּה מַיִם מִן הַנָּהָר וְמִן הָאֲגַם,

שֶׁמְּסַכֵּן אַתָּה אֶת בְּרִיאוּתְךָ וְאֶת אוֹר עֵינֶיךָ.

וְאִם אָזְלוּ הַמַּיִם מִכַּדְּךָ,

דְּפֹק עַל כִּסּוּי הַכַּד וֶאֱמֹר לְעַצְמְךָ:

'– פְּלוֹנִי בֶּן פְּלוֹנִית (שִׁמְךָ וְשֵׁם אִמְּךָ)

אָמְרָה לְךָ אִמְּךָ:

הִזָּהֵר מִשַּׁבְרִירִי

שַׁבְרִירִי, בְּרִירִי,

רִירִי, רִיר, רִי…

(מִין לַחַשׁ הוּא, שֶׁל ‘לָשוֹן נוֹפֵל עַל לָשׁוֹן’)

הַקַּל לִזְכִירָה וּמַעֲמִיק בַּזִכָּרוֹן אֶת עֶצֶם הָעֵצָה
",ספרות עברית חדשה,1979
תקוה שריג,ארבעה גאים מי יודע?,"אַרְבָּעָה גֵּאִים הֵם בָּעוֹלָם:

שׁוֹר בַּבְּהֵמוֹת,

אַרְיֵה בַּחַיּוֹת,

נֶשֶׁר בָּעוֹפוֹת

וְאָדָם גֵּאֶה עַל כֻּלָּם!
",ספרות עברית חדשה,1979
תקוה שריג,בלועי קרח,"וְעוֹד טִיַּלְנוּ בְּסִינַי, אוֹתוֹ עַרְבִי וַאֲנִי.

אָמַר לִי:

– רַבִּי, רוֹצֶה אַתָּה לִרְאוֹת הַמָּקוֹם בַּמִּדְבָּר,

שֶׁבּוֹ נִבְלְעוּ קׂרַח וְכָל עֲדָתוֹ,

כַּאֲשֶׁר קָמוּ עַל מׂשֶׁה וּמָרְדוּ בּוֹ?

אָמַרְתִּי לְאוֹתוֹ עַרְבִי:

– רוֹצֶה!

בָּאנוּ לְמָקוֹם שׁוֹמֵם וְרָאִיתִי בּוֹ שְׁנֵי סְדָקִים בָּאֲדָמָה,

וְעָשָׁן עוֹלֶה מֵהֶם.

לָקַחְתִּי גִּזַּת צֶמֶר, הִרְטַבְתִּי אוֹתָהּ בְּמַיִם,

נָעַצְתִּי בָּה אֶת הָרׂמַח שֶׁבְּיָדִי וְהִכְנַסְתִּיו לַסֶּדֶק.

הִתְלַהֵט מִיָּד הָרׂמַח וְהוֹצֵאתִיו מִן הַסֶּדֶק.

נִמְצְאָה גִּזַּת הַצֶּמֶר שְׂרוּפָה בָּאֵשׁ.

אָמַר לִי אוֹתוֹ עַרְבִי:

– שִׂים אָזְנְךָ עַל הָאֲדָמָה עַל יַד הַסֶּדֶק וְהַקְשֵׁב.

עָשִׂיתִי כִּדְבָרָיו וְשָׁמַעְתִּי קוֹלוֹת אֲנָשִׁים צוֹעֲקִים.

אָמַר לִי אוֹתוֹ עַרְבִי:

– בְּלוּעֵי קׂרַח הֵם, הַזּוֹעֲקִים הַשְׁכֵּם וְהַעֲרֵב, כָּל הַיָּמִים:

""מׂשֶׁה וְתוֹרָתוֹ אֱמֶת

וַאֲנַחְנוּ חָטָאנוּ וְאָשַׁמְנוּ לוֹ!""",ספרות עברית חדשה,1979
תקוה שריג,בשבח השמחה,"רַבִּי בְּרוֹקָא צַדִּיק גָּדוֹל הָיָה וְאֵלִיָּהוּ הַנָּבִיא הָיָה מְלַוֶּה אוֹתוֹ בַּסֵּתֶר.

פַּעַם אַחַת טִיֵּל בֵּין אֲנָשִׁים בַּשּׁוּק וְהָיָה תּוֹהֶה

מִי מֵהֶם צַדִּיקִים גְּמוּרִים.

הִצְבִּיעַ לְפָנָיו אֵלִיָּהוּ הַנָּבִיא עַל שְׁנֵי יְהוּדִים שֶׁנִּזְדַּמְּנוּ עַל יָדָם וְאָמַר:

– שְׁנֵי אֲנָשִׁים אֵלֶּה צַדִּיקִים גְּמוּרִים הֵם.

שָׁאַל אוֹתוֹ רַבִּי בְּרוֹקָא:

– וּמַהִי צִדְקָתָם?

אָמַר לוֹ אֵלִיָּהוּ הַנָּבִיא:

– שְׁאַל אוֹתָם!

שָׁאַל אוֹתָם רַבִּי בְּרוֹקָא:

– מַה מַעֲשֵׂיכֶם?

אָמְרוּ לוֹ:

– בְּנֵי אָדָם שְׂמֵחִים אֲנַחְנוּ וּמְשַׂמְּחִים אֲנָשִׁים עֲצוּבִים…
",ספרות עברית חדשה,1979
תקוה שריג,גחלי רתמים,"חַכְמֵי הַתַּלְמוּד הָיוּ מַרְבִּים בִּנְסִיעוֹת וּמַסָּעוֹת בַּיָם וּבַיַּבָּשָׁה.

סִפֵּר רַבִּי הוּנָא בַּר־נָתָן:

פַּעַם אַחַת, הָיִינוּ מְהַלְּכִים בַּמִּדְבָּר,

וְהָיָה לָנוּ שׁוֹק מְיֻבָּש שֶׁל עֶגֶל לִמְזוֹנֵנוּ.

חָתַכְנוּ אֶת הַבָּשָׂר לִנְתָחִים וְהִנַּחְנוּ אוֹתָם עַל הָעֲשָׂבִים שֶׁגָּדְלוּ בְּאוֹתוֹ מָקוֹם.

הָלַכְנוּ לְחַפֵּשׂ קוֹצִים וּזְרָדִים לְהַדְלִיק בָּהֶם אֵשׁ,

שֶׁתִּצְלֶה אֶת הַבָּשָׂר.

כְּשֶׁבָּאנוּ וְהַזְּרָדִים בְּיָדֵינוּ,

מָצָאנוּ אֶת נִתְחֵי הַבָּשָׂר שֶׁנִּתְלַכְּדוּ לְשׁוֹק

וְהָיְתָה הַשּׁוֹק צְלוּיָה הֵיטֵב וּמוּכָנָה לַאֲכִילָה.

כַּעֲבׂר שְׁנֵים־עָשָׂר חׂדֶש,

שׁוּב נִזְדַּמַּנּוּ לְאוֹתוֹ מָקוֹם

וּמָצָאנוּ אֶת הַגֶּחָלִים שֶׁהוֹתַרְנוּ – לוֹחֲשׁוֹת אֵשׁ.

אָמַר לִי עַרְבִי בַּמִּדְבָּר:

– עֵשֶׂב זֶה שֶׁרִפֵּא אֶת נִתְחֵי הַבָּשָׂר – סַמַתְרִי שְׁמוֹ,

וְגֶחָלִים אֵלּוּ, גַּחֲלֵי רְתָמִים הֵן…

",ספרות עברית חדשה,1979
