שם מלא,שם סיפור,הסיפור,תקופה,שנה
תקוה שריג,העזאזל היכן הוא?,"הָיֹה הָיוּ אַחִים שְׁנַיִם,

הָאֶחָד עָשִׁיר, הַשֵּׁנִי עָנִי.

שָׁנִים אֲחָדוֹת נָתַן הָאָח הֶעָשִׁיר לָאָח הֶעָנִי

חִטָּה מִקְּצִיר שָׂדֵהוּ, שֶׁיֹּאפֶה מִמֶּנָה מַצּוֹת לְפֶסַח.

פַּעַם אַחַת, בְּעֶרֶב פֶּסַח,

בָּא הָאָח הֶעָנִי אֶל אָחִיו הֶעָשִׁיר,

כְּדַרְכּוֹ מִדֵּי שָׁנָה בְּשָׁנָה, לְקַבֵּל חִטָּה.

דָּחָה הָאָח הֶעָשִׁיר אֶת הָאָח בְּאָמְרוֹ:

– בּוֹא מָחָר!

כָּךְ עָשָׂה יָמִים אֲחָדִים.

לְבַסּוֹף גֵּרֵשׁ אוֹתוֹ בְּאָמְרוֹ:

– לֵךְ לַעֲזָאזֵל!

חָזַר הֶעָנִי לְבֵיתוֹ, בְּלֵב נִשְׁבָּר מֵעֶלְבּוֹן וּמַחְסוֹר.

לָקַח אֶת טַלִּיתוֹ וְאֶת הַתְּפִלִּין שֶׁלּוֹ,

נִפְרַד מֵאִשְׁתּוֹ וִילָדָיו וְיָצָא לַדֶּרֶךְ,

לְחַפֵּשׂ הֵיכָן הָעֲזָאזֵל…",ספרות עברית חדשה,1983
תקוה שריג,הרב אבו חצירא ותותחי השיח,"דּוֹרוֹת עַל דּוֹרוֹת יָשְׁבוּ הַיְּהוּדִים בְּעָרֵי מָרוֹקוֹ,

בַּמַּלָאח, הוּא הַגֶּטוֹ שֶׁל אַרְצוֹת צְפוֹן אַפְרִיקָה.

עִקַּר פַּרְנָסָתָם הָיְתָה עַל הַמִּסְחָר וְעַל הַמְּלָאכָה,

כִּי נֶאֱסַר עֲלֵיהֶם מִכֹּל־וָכֹל לִרְכּשׁ קַרְקָעוֹת

וּלְהִתְפַּרְנֵס מֵעֲבוֹדַת אֲדָמָה.

הַמִּסְחָר בְּעָרֵי מָרוֹקוֹ הָיָה מִתְנַהֵל בִּימֵי־שׁוּק

אַחַת לְשָׁבוּעַ, עִיר וָעִיר וְהַיּוֹם הַקָּבוּעַ שֶׁלָּהּ.

הַיְּהוּדִים הָיוּ מַנִּיחִים אֶת פְּרִי מְלַאכְתָּם –

תַּכְשׁיטִים שֶׁיָּצְרוּ, אֲרִיגִים שֶׁטָּווּ, בְּגָדִים שֶׁתָּפְרוּ

כְּלֵי פַּח שֶׁעשׂוּ, רָהִיטִים וּמַחְצָלוֹת,

אֶת כָּל אֵלֶּה הִצִּיגוּ בַּשּׁוּק, עַל דּוּכָנִים,

בְּצַד הַפַּלָּחִים הָעֲרָבִים – קוֹנִים מִכָּל הַבָּא לַיָּד.

הַשַּׁלִּיטִים הָיוּ גוֹבִים מִסִּים גְּבוֹהִים

וּבְעִקָּר הָיוּ מְצִיקִים לַיְּהוּדִים.


בִּכְפַר אַרְפוֹד, לֹא הַרְחֵק מִן הָעִיר מַארַאקֶשׁ

הָיְתָה קְהִלָּה יְהוּדִית וּבְרֹאשָׁהּ רַבָּהּ, אַבּוּ־חֲצֵירָא

בֵּן שׁוֹשֶׁלֶת רַבָּנִים, שֶׁהֶעֱמִידָה גְאוֹנִים רַבִּים.

הַשֵּׁיח' שֶׁל אוֹתוֹ כְּפָר, אַרְפוֹד,

שׂוֹנֵא־יְהוּדִים גָּדוֹל הָיָה.

בִּפְנֵי אָדָם אֶחָד הָיָה לוֹ דֶרֶךְ־אֶרֶץ, וַאֲפִלּוּ פַּחַד,

בִּפְנֵי הָרַב אַבּוּ־חֲצֵירָא הַזָּקֵן הַזָּקוּף וְהַגֵּאֶה.

כְּנֶגֶד כָּל גְּזֵרָה שֶׁהַשֵּׁיח' גָּזַר עַל הַיְּהוּדִים בִּכְפָרוֹ,

יָדַע הָרַב אַבּוּ־חֲצֵירָא לְהַנְהִיג אֶת בְּנֵי עֲדָתוֹ

בְּאֹפֶן שֶׁהָיוּ מִתְגַּבְּרִים עַל הַגְּזֵרוֹת.

כָּךְ הָיָה שָׁנִים רַבּוֹת עַד הַיּוֹם הַמַּר…


יוֹם אֶחָד, הֶחְלִיט הַשֵּׁיח' לְהִפָּטֵר מֵהָרַב אַבּוּ־חֲצֵירָא.

מֶה עָשָׂה?

הוֹצִיא כָּרוֹז שֶׁהָיָה מְהַלֵּךְ בַּשּׁוּק וּמַכְרִיז:

– עַל יְהוּדֵי אַרְפוֹד לְהָבִיא לַשֵּׁיח'

בְּתֹם שְׁלשָׁה יָמִים –

מָאתַיִם אֶלֶף דַּרְכְּמוֹנוֹת זָהָב

וְהָיָה אִם לֹא יָבִיאוּ יוּמְתוּ בְּמִיתוֹת מְשֻׁנּוֹת…


הַיּוֹם הַשְּׁלִישִׁי לַגְּזֵרָה – יוֹם שַׁבָּת הָיָה.

וְהַיְּהוּדִים שֶׁנִּקְהֲלוּ בְּבֶהָלָה אֶל רַבָּם אַבּוּ־חֲצֵירָא,

שָׁבוּ לְבָתֵּיהֶם וְעָשׂוּ אֶת הַשַּׁבָּת בִּקְדֻשָּׁה וּבְטָהֳרָה.

כֵּיוָן שֶׁהִרְגִּיעָם רַבָּם וְאָמַר:

– גְּזֵרַת הַשֵּׁיח' אֵינֶנָּה גְזֵרָה מִן הַשָּׁמַיִם!

רָחֲצוּ וְלָבְשׁוּ כְּמִנְהָגָם מִדֵּי עֶרֶב שַׁבָּת,

רָחֲצוּ וּמֵרְקוּ אֶת בָּתֵיהֶם וְאֶת חַצְרוֹתֵיהֶם,

הִכְנִיסוּ אֶת הַ“חַמִּין” לְתַנּוּר הַבָּנוּי חֵמָר, לַ“פָ’רוֹנָה”,

הַגְּבָרִים הִתְפַּלְלוּ בְּבֵית־הַכְּנֶסֶת בְּחִיל וּרְעָדָה,

הַנָּשִׁים הִדְלִיקוּ נֵרוֹת שַׁבָּת כְּמִסְפַּר הַנְּפָשׁוֹת בְּבֵיתָן –

וְאָכְלוּ אֶת סְעֻדַּת לֵיל־שַׁבָּת כַּהֲלָכָה.

עַל הַשֻּׁלְחָן הִתְנוֹצְצוּ כְּלֵי הַבְּדֹלַח

וּכְלֵי הַזְּכוּכִית הַמֻּזְהֶבֶת

שֶׁנֵּרוֹת הַשַּׁבָּת הִשְׁתַּקְּפוּ בְּתוֹכָם בְּאוֹר יְקָרוֹת.

הֵם שָׁרוּ זְמִירוֹת וּפִיּוּטִים

וְדָחֲקוּ מִלִּבָּם אֶת הַפַּחַד הַגָּדוֹל

בִּפְנֵי יוֹם הַמָּחָר.

תּוֹךְ כְּדֵי זִמְרָתָם – הִתְבּוֹנְנוּ אִישׁ בִּפְנֵי רֵעֵהוּ,

כְּמוֹ תּוֹהִים, אִם יִזְכּוּ, יוֹסִיפוּ וְיַעֲשׂוּ

עוֹד שַׁבָּתוֹת כְּשֵׁרוֹת

וְאַף אִם יַעַרְכוּ לְמָחֳרַת הַיּוֹם אֶת הַ“הַבְדָּלָה”…


הָרַב הַזָּקֵן אַבּוּ־חֲצֵירָא הָיָה רָגוּעַ,

כִּי צִוָּה עַל כָּל בְּנֵי עֲדָתוֹ לְהִתְאַסֵּף לְמָחֳרַת,

כֻּלָּם כְּאֶחָד, לְבֵית־הַכְּנֶסֶת, וְלַעֲמֹד כָּל הַיּוֹם בִּתְפִלָּה,

כִּי בָּטַח בֵּאלֹהִים,

שֶׁהַשַּׁבָּת תִּשְׁמֹר עֲלֵיהֶם מִכָּל רַע.


וּמְשָׁרֵת עֲרָבִי הָיָה לָרַב

שֶׁאָהַב אֶת הָרַב וְשֵׁרְתוֹ בֶּאֱמוּנָה,

אֲבָל כְּשֶׁנִּגְזְרָה אוֹתָהּ גְּזֵרָה,

חָשַׁשׁ מְאֹד לְנַפְשׁוֹ, שֶׁמָּא יֵהָרֵג עִם אֲדוֹנוֹ.

כְּשֶׁשָּׁמַע מִפִּי הָרַב עַל כַּוָּנָתוֹ,

ציור 9.png
לֶאֱסֹף לַמָּחֲרַת, לְבֵית־הַכְּנֶסֶת

אֶת כָּל בְּנֵי עֲדָתוֹ,

הָלַךְ בַּסֵּתֶר לְבֵית הַשֵּׁיח'

וְגִלָּה אֶת כַּוָּנַת הָרַב לְאָזְנוֹ.

וְהַשֵּׁיח', שֶׁחָשַׁשׁ מִפְּנֵי קְדֻשַּׁת הָרַב,

וּמִפְּנֵי קְדֻשַּׁת הַשַּׁבָּת שֶׁל הַיְּהוּדִים,

הִתְחַכֵּם וְהֶחְלִיט

שֶׁלֹּא יְכַוֵּן אֶת תּוֹתָחָיו עַל הַמַּלָאח בַּשַּׁבָּת,

כְּשׁיִּהְיוּ הַיְּהוּדִים מוּגַּנִּים בִּקְדֻשָּׁתָהּ,

אֶלָּא בְּמוֹצָאֵי־שַׁ‏בָּת,

כְּשֶׁאוֹתָהּ קְדֻשָּׁהּ תִּסְתַּלֵּק לָהּ מִן הַיְּהוּדִים.


וְכָךְ הָיָה,

כְּשֶׁשָּׁבוּ הַיְּהוּדִים לְבָתֵּיהֶם מִבֵּית־הַכְּנֶסֶת

בּוֹ שָׁהוּ כָּל אוֹתָהּ שַׁבָּת,

וְהִתְכַּוְּנוּ לְהַדְלִיק נֵר שֶׁל הַבְדָּלָה,

רָעֲמוּ תּוֹתְחֵי הַשֵּׁיח'

וְהַפְּגָזִים הָרְגוּ בַּיְּהוּדִים אֲנָשׁים נָשִׁים וָטַף

וְגַם הָרַב אַבּוּ־חֲצֵירָא נֶהֱרָג עִם בְּנֵי עֲדָתוֹ.

הַיְּהוּדִים שֶׁנִּשְׁאֲרוּ בַּחַיּיִם נִמְלְטוּ עַל נַפְשָׁם

וּמֵאָז לֹא יָשְׁבוּ עוֹד יְהוּדִים בִּכְפַר אַרְפוֹד.",ספרות עברית חדשה,1983
תקוה שריג,הרוכל מגביש ומאנסור אבן סאלם הלסטים,"כְּמוֹ בְּאַרְצוֹת אֵירוֹפָּה כָּךְ בְּאַרְצוֹת עֲרָב,

בְּכָל מָקוֹם שֶׁהַשַּׁלִּיטִים לֹא הִרְשׁוּ לַיְּהוּדִים

לִקְנוֹת לָהֶם קַרְקַע,

לְעַבֵּד אוֹתָהּ וּלְהִתְפַּרְנֵס מִפֵּרוֹתֶיהָ,

נֶאֶלְצוּ הַיְּהוּדִים לְהִתְפַּרְנֵס מִמְּלָאכָה וּמִסְחָר.

מֵהֶם הָיוּ חַיָּטִים, צוֹרְפִים, סַנְדְּלָרִים, בּוּרְסְקָאִים

מֵהֶם הָיוּ סוֹחֲרִים גְּדוֹלִים וַעֲשִׁירִים

שֶׁסָּחֲרוּ עִם אַרְצוֹת־חוּץ,

מֵהֶם חֶנְוָנִים גְּדוֹלִים וּקְטַנִּים,

מֵהֶם רוֹכְלִים נוֹדְדִים בֵּין הָעֲיָרוֹת וְהַכְּפָרִים

וּמוֹכְרִים סִדְקִית, בַּדִּים וּשְׁאָר מִצְרָכִים קְטַנִּים.

אֶרֶץ לוּב מְעוּטַת תּוֹשָׁבִים הָיְתָה בַּדּוֹרוֹת שֶׁעָבְרוּ

וַאֲפִלּוּ הַיּוֹם עֲדַיִן בִּלְתִּי מְיֻשֶּׁבֶת הִיא בְּרֻבָּהּ.

בֵּין כְּפָר לִכְפָר, בֵּין עֲיָרָה לַעֲיָרָה – מִדְבַּר שְׁמָמָה,

מַמְלֶכֶת גַּזְלָנִים וְשׁוֹדְדִים.

מֶלֶךְ הַלִּסְטִים, לִפְנֵי דוֹרוֹת אֲחָדִים,

גַּזְלָן שֶׁהִצְמִיחַ מַעֲשִׂיּוֹת וְאַגָּדוֹת לָרֹב,

הָיָה הַשּׁוֹדֵד מַאנְסוּר אִבְּן־סַאלַם.


יוֹם אֶחָד, רָאָה הָרוֹכֵל הַיְּהוּדִי,

מַגְבִּישׁ אַבּוּ־חָדִיד, בִּטְרִיפּוֹלִי,

אָדָם אֶחָד חָסֹן וּשְחֹר עוֹר

עוֹמֵד עִם חֲמוֹרוֹ בְּכִכַּר הַשּׁוּק,

מַבִּיט סְבִיבוֹ בְּעֵינַיִם תּוֹהוֹת־בּוֹהוֹת

וּמַרְאֵהוּ חוֹלֶה מְאֹד;

יְלָדִים נֶאֱסָפִים סְבִיבוֹ וּמִתְקַלְּסִים בּוֹ.

וְהָאִישׁ, עַל אַף חָסְנוֹ,

אֵינוֹ מֵגִיב עַל טַרְדָנוּתָם.

הָיָה הַמַּרְאֶה מוּזָר בְּעֵינֵי מַגְבִּישׁ.

נִגַּשׁ אֵלָיו, בֵּרַךְ אוֹתוֹ לְשָׁלוֹם וְאָמַר לוֹ:

– רוֹאֶה אֲנִי שֶׁאַתָּה חוֹלֶה בַּגּוּף אוֹ בַּנֶּפֶשׁ,

בּוֹא לְבֵיתִי, תָּנוּחַ, תֹּאכַל וְתִשְׁתֶּה וְיִיטַב לְךָ.

הָלַךְ הָאִישׁ עִם חֲמוֹרוֹ אַחֲרֵי מַגְבִּישׁ לְבֵיתוֹ

שָׁהָה שָׁם יְמָמָה אַחַת, נָח, אָכַל וְשָׁתָה

וְרָחַץ אֶת גּוּפוֹ עַד שֶׁהִתְאוֹשֵׁשׁ כָּלִיל.

שָׁלַח מַגְבִּישׁ בְּכָבוֹד וּבִידִידוּת אֶת אוֹרְחוֹ

וְנָתַן לוֹ לְשַׂקּוֹ צֵידָה מְשֻׁבַּחַת לַדֶּרֶךְ.

בְּרֶגַע הַפְּרִידָה אָמַר הָאוֹרֵחַ לַמְאָרֵחַ:

– עוֹד נִתְרָאֶה בְּרֶגַע שָׁחֹר…


עָבְרוּ שָׁנִים וְאוֹתוֹ אוֹרֵחַ מוּזָר נִשְׁכַּח מִלֵּב מַגְבִּישׁ.

הוּא הָיָה מְהַלֵּךְ בֵּין הַכְּפָרִים וְהָעֲיָרוֹת

וְחוֹזֵר עַל בָּתֵּי הָעֲרָבִים וּהַיְּהוּדִים וּמוֹכֵר אֶת מַרְכֻּלְתּוֹ

וְשָׁב לִקְרַאת שַׁבָּת לִטְרִיפּוֹלִי, לְבֵיתוֹ.


יוֹם אֶחָד, הָיָה מַגְבִּישׁ מְהַלֵּךְ בַּמִּדְבָּר,

בֵּין כְּפָר לִכְפָר,

וְיוֹדֵעַ שֶׁיֵּשׁ, בְּאוֹתוֹ מִדְבָּר, הָרִים וּמְצוֹקִים

וּבֶהָרִים – נְקָרוֹת, מְעָרוֹת וּמִנְהָרוֹת

וּבַמְּעָרוֹת גַּזְלָנִים, שׁוֹדְדִים, לִסְטִים לְמֵאוֹת.

הָיָה מַגְבִּישׁ הוֹלֵךְ בְּעִקְבוֹת חֲמוֹרוֹ

וּמְפַזֵּם לוֹ מִזְמוֹרֵי תְּהִלִּים לְחַזֵּק אֶת לִבּוֹ.

פִּתְאֹם צָמְחוּ לִקְרָאתוֹ, כְּמוֹ צָצוּ מִן הָאֲדָמָה,

שְׁלשָׁה אֲנָשִׁים לְבוּשֵׁי שְׁחֹרִים,

רְעוּלֵי פָּנִים וְאָמְרוּ לְמַגְבִּישׁ:

– יְהוּדִי! תֵּן לָנוּ אֶת חֲמוֹרְךָ

וְאֶת כָּל הַכֶּסֶף שֶׁבְּכִיסֵי בְּגָדֶיךָ וְלֵךְ לַחָפְשִׁי

בַּדֶּרֶךְ הַקְּצָרָה בְּיוֹתֵר לִטְרִיפּוֹלִי, שֶׁנַּרְאֶה אוֹתָהּ לְךָ…

אִם אַתָּה מִתְנַגֵּד, נַשְׁאִיר לְךָ כָּל מַה שֶּׁבְּיָדֶיךָ,

וְנוֹלִיךְ אוֹתְךָ לְדֶרֶךְ אֲרֻכָּה מְאֹד

שֶׁכָּל הַהוֹלְכִים בָּהּ,

אֵינָם מַגִּיעִים לְעוֹלָם לִמְחוֹז חֶפְצָם…

בָּחַר מַגְבִּישׁ לָתֵת לָהֶם אֶת כָּל אֲשֶׁר לוֹ

וְלָלֶכֶת בַּדֶּרֶךְ הַקְּצָרָה שֶׁתָּבִיא אוֹתוֹ לְבֵיתוֹ וּמִשְׁפַּחְתוֹ

וַאֲפִלּוּ יִהְיֶה חֲסַר־כֹּל.

הִתְחִיל צוֹעֵד בְּאוֹתָהּ דֶּרֶךְ.

בֵּינְתַיִם יָרַד הַיּוֹם וְחשֶׁךְ מִצְרַיִם כִּסָּה עַל הַמִּדְבָּר.

תַּנִּים יִלְּלוּ, צְבוֹעִים צָחֲקוּ וְדָמוֹ שֶׁל מַגְבִּישׁ

קָפָא בְּעוֹרְקָיו מֵרֹב פַּחַד.

פִּתְאֹם צָמְחָה מוּל עֵינָיו

דְּמוּת שׁוֹדֵד שְׁחֹרָה, רְעוּלָה.

– לְאָן אַתָּה הוֹלֵךְ לְבַדְּךָ בַּמִּדְבָּר, יְהוּדִי?

הָרֵם מִיָּד אֶת שְׁתֵּי יָדֶיךָ

וְאֵדַע שֶׁאֵין בָּהֶן חֶרֶב!


הֵרִים מַגְבִּישׁ אֶת שְׁתֵּי יָדָיו

וְהוּא רוֹעֵד כְּלוּלָב.

אָמַר לוֹ הַשּׁוֹדֵד:

– אַל תְּפַחֵד, יְהוּדִי, סַפֵּר לִי, מַה מַּעֲשֶׂיךָ כָּאן?

סִפֵּר לוֹ מַגְבִּישׁ עַל שְׁלשֶׁת הַלִּסְטִים

שֶׁלִּסְטְמוּ אוֹתוֹ…

– בּוֹא אִתִּי – אָמַר הַשּׁוֹדֵד

וְלָקַח אֶת יַד הָרוֹכֵל בְּיָדוֹ.

הָלַךְ מַגְבִּישׁ עִם הַלִּסְטִים,

כַּהֲלֹךְ יֶלֶד קָטָן עִם אָבִיו מוֹלִידוֹ

עַד לִמְעָרָה אַחַת שֶׁבָּהָר.

נִכְנְסוּ לַמְּעָרָה וְרָאָה בָּהּ מַגְבִּישׁ

אֶת חֲמוֹרוֹ וְאֶת סְחוֹרָתוֹ

וּקְבוּצַת הַשּׁוֹדְדִים גְּלוּיֵי פָּנִים

יוֹשְׁבִים סָבִיב לִמְדוּרָה קְטָנָּה וְשׁוֹתִים קָפֶה.

הִזְעִים הַשּׁוֹדֵד שֶׁהֶחֱזִיק בִּידֵי מַגְבִּישׁ אֶת פָּנָיו וְצָעַק:

– בְּנֵי־בְּלִיַּעַל!

הַחֲזִירוּ מִיָּד לְאָדָם זֶה אֶת גְּזֵלַתְכֶם,

אִם לֹא תָּעֲשׂוּ כֵּן, מָרָה תִּהְיֶה אַחֲרִיתְכֶם!

אָז פָּנָה אֶל מַגְבִּישׁ

שֶׁעֲדַיִן עָמַד חִוֵּר וְשִׁנָּיו נוֹקְשׁוֹת:

– הַאִם אַתָּה מַכִּיר אוֹתִי, יְהוּדִי?

– לֹא – הֵשִׁיב מַגְבִּישׁ בִּרְעָדָה –

לֹא, אֵינִי נִזְכָּר כְּלָל בְּמַרְאֶה פָּנֶיךָ.

– וְאֵינְךָ זוֹכֵר שֶׁהִזְמַנְתָּ לְבֵיתְךָ

אָדָם זָר שֶׁעָמַד חוֹלֶה וְכוֹאֵב

בְּכִכַּר הַשּׁוּק שֶׁבִּטְרִיפּוֹלִי,

וְסָעַדְתָּ אוֹתוֹ, עַד שֶׁהֶחֱלִים,

וְגַם שָׁלַחְתָּ אוֹתוֹ לַדֶּרֶךְ

וְגַם צֵידָה טוֹבָה נָתַתָּ לְתוֹךְ שַׂקּוֹ?

ציור 9.png
– כֵּן, עַכְשָׁו אֲנִי מַכִּיר אֶת פָּנֶיךָ,

אוֹרְחִי מְכֻבָּדִי – נִזְכַּר מַגְבִּישׁ.

– וְהִנֵּה עַכְשָׁו הִגִּיעַ אוֹתוֹ “רֶגַע שָׁחֹר” –

אָמַר הָאִישׁ.

– הַיּוֹם, אַתָּה הוּא זֶה שֶׁנָּפַלְתָּ בְּצָרָה

וְיֵשׁ בְּיָדִי לִגְמֹל לְךָ עַל חַסְדְּךָ עִמִּי.

קַח לְךָ אֶת חֲמוֹרְךָ, אֶת סְחוֹרָתְךָ וְאֶת כַּסְפְּךָ

וַאֲנִי עוֹד אוֹסִיף עַל אֵלֶּה, כָּהֵנָּה וְכָהֵנָּה.

הוֹבִיל הַשּׁוֹדֵד אֶת מַגְבִּישׁ עַד מְבוֹאוֹת טְרִיפּוֹלִי

וְגָדַשׁ אֶת הַשַּׂקִּים שֶׁעַל גַּב הַחֲמוֹר בְּכָל טוּב.

כְּשֶׁנִּפְרַד מִמֶּנּוּ לָחַשׁ לְאָזְנוֹ:

– יְדִידִי, אִם יִשְׁאֲלוּ אוֹתְךָ אַנְשֵׁי הָעִיר

מִיהוּ זֶה שֶׁהִצִּיל אוֹתְךָ בְּרֶגַע שָׁחֹר

גָּמַל לְךָ טוֹבָה וְנָתַן לְךָ אוֹר,

וּמִיהוּ זֶה שֶׁאֵינוֹ שׁוֹכֵחַ אֶת מֵיטִיבוֹ,

תָּשִׁיב לָהֶם:

– זֶהוּ הַשּוֹדֵד הַגָּדוֹל מִכָּל הַשּוֹדְדִים בְּאֶרֶץ לוּב

מַאנְסוּר אִבְּן־סַאלַם הַמְפֻרְסָם בָּעוֹלָם…
",ספרות עברית חדשה,1983
תקוה שריג,השבת השחורה של חנוכה,"יוֹם אֶחָד, בְּעֶרֶב־שַׁבָּת־שֶׁל־חֲנֻכָּה,

חָשְׁקוּ נְשׁוֹת הַקּוּסְבָּה לְהִתְאַסֵּף

בַּ“קוּסְבָּה”, שֶׁאֶחָד מִשְּׁמוֹת הַגֶּטוֹ הוּא בְּלוּב,

לִשְׁתּוֹת תֵּה מָתוֹק,

לִזְלֹל סֻפְגָּנִיּוֹת,

וּלְרַכֵל בְּצַוְתָּא.

עִם זֹאת, חָשְׁשׁוּ פֶּן לֹא יַסְפִּיקוּ

לְהָכִין לִכְבוֹד שַׁבַּת חֲנֻכָּה

סְעֻדָּה שְׁמֵנָה וּטְעִימָה כַּהֲלָכָה.

חָשְׁבוּ חָשְׁבוּ, עַד שֶׁמָּצְאוּ:

הֵן תִּלְכֹּדְנָה אֶת הַחַמָּה בַּצָּהֳרַיִם

לְתוֹךְ דְּלִי מָלֵא מַיִם

ציור 10.png
וּבָעֶרֶב, עִם שְׁקִיעַת הַחַמָּה

תָּאִיר לָהֶן הַחַמָּה הַחֲבוּיָה בַּמַּיִם

וְכָךְ יֶאֱרַךְ יוֹמָן כֶּפֶל כִּפְלַיִם…

יָשְׁבוּ, שָׁתוּ, זָלְלוּ, רִכְלוּ אֵין־קֵץ,

עַד שֶׁשָּׁקְעָה הַחַמָּה.

מִהֲרוּ לְהוֹצִיא אֶת הַחַמָּה הַחֲבוּיָה בַּמַּיִם

כְּדֵי שֶׁיִּתְלוּ אוֹתָהּ עַל עֵץ,

וְתָאִיר לָהֶם אֶת אוֹר הַיּוֹם,

וְהֵן תָּכֵנָּה אֶת סְעֻדַּת שַׁבָּת־שֶׁל־חֲנֻכָּה.

וְהִנֵּה, לֹא הָיְתָה שׁוּם חַמָּה בַּדְּלִי,

כְּמוֹ לֹא נִבְרְאָה…

יָשְׁבוּ נְזוּפוֹת בַּחֲשֵׁכָה.

בָּאוּ הַבְּעָלִים מִבֵּית־הַכְּנֶסֶת

וְהִנֵּה אֲפֵלָה בַּבָּתִּים

וּבִמְקוֹם נִצְנוּץ נֵרוֹת חֲנֻכָּה –

חֲשֵׁכָה קָשָׁה וּשְׁתִיקָה…


סִפְּרוּ הַנָּשִׁים הַפְּתַיּוֹת לַבְּעָלִים

עַל מַעֲשֵׂיהֶן בְּאוֹתוֹ יוֹם…

הָיְתָה זוֹ הַפַּעַם הָאַחַת וְהַיְּחִידָה,

בְּדִבְרֵי יְמֵי הַקּוּסְבָּה

שֶׁשָּׁרְתָה חֲשֵׁכָה עַל בָּתֵּי יִשָׂרָאֵל

וְאֵין יוֹצֵא וְאֵין בָּא…
",ספרות עברית חדשה,1983
תקוה שריג,זעת אפים שוה זהב פרוים,"פַּעַם בָּא נַעַר צָעִיר לִפְנֵי אִישׁ עָשִׁיר

וּבִקֵּשׁ לַעֲבֹד לְמַעֲנוֹ.

שָׁאַל הֶעָשִׁיר:

– וּמַהוּ הַשָּׂכָר אֲשֶׁר תְּבַקֵּשׁ, הַנַּעַר?

הוֹצִיא הַנַּעַר מִכִּיסוֹ מַטְלִית צֶמֶר וְאָמַר:

– כְּמִשְׁקַל מַטְלִיתֶ־צֶמר זוֹ.

הִתְפַּלֵא הֶעָשִׁיר עַל הַשָּׂכָר הַמּוּעָט שֶׁמְּבַקֵּשׁ הַנַּעַר,

אֲבָל נֶעְתַּר לְבַקַּשַׁתוֹ שֶׁהָיְתָה לְטוֹבָתוֹ.

עָבַד הַנַּעַר הַצָּעִירֵ אֶצל הֶעָשִׁיר

בְּכָל עֲבוֹדָה קָשָׁה וּמְפָרֶכֶת

וְנִגֵּב אֶת זֵעָתוֹ בְּמַטְלִית־הַצֶּמֶר…


כַּעֲבֹר שָׁנָה לַעֲבוֹדַת הַנַּעַר, הֵבִיא הֶעָשִׁירֹ מֹאזְנַיִם,

בִּכְדֵי לִשְׁקֹל אֶת מַטְלִית־הַצֶּמֶר

וּלְשַׁלֵּם לַנַּעַר אֶת מַשְׂכֻּרְתוֹ כְּבַקָּשָתוֹ.

שָׂם הֶעָשִׁיר אֶת מַטְלִית־הַצֶּמֶר עַל הַכַּף הָאַחַת,

וְאֶת שִׁקְלֵי הַזָּהָב עַל הַכַּף הַשְּׁנִיָּה,

וְהָיָה מוֹסִיף שֶׁקֶל אַחַר שֶׁקֶל

וַעֲדַיִן הָיְתָה כַּף מַטְלִית־הַצֶּמֶר כְּבֵדָה יוֹתֵר.

הִשְׁתּוֹמֵם הֶעָשִׁיר, גַם נֶחֱרַד לַמַּרְאֶה, וְשָׁאַל:

– הַאִם יוֹדֵעַ אַתָּה אֶת סוֹד הַמֹאזְנַיִם, נַעַר?

– בְּוַדַּאי! – הֵשִׁיב הַנַּעַר,

– זֶהוּ מִשְׁקָלָהּ שֶׁל הַזֵּעָה שֶׁהִזַּעְתִּי

כְּשֶׁעָבַדְתִּי אֶצְלְךָ כָּל יְמוֹת הַשָׁנָה…

הִסְכִּים הֶעָשִׁיר לְחָכְמַת הַצָּעִיר

וְשִׁלֵּם לֹו תְמוּרַת זֵעָתוֹ שִׁקְלֵי זָהָב, טָבִין וּתְקִילִין.",ספרות עברית חדשה,1983
